  0.000000 131.94.132.160 -> 131.94.134.13 TCP 49477 > ssh [SYN] Seq=0 Win=8192 Len=0 MSS=1460 WS=8
  0.000000 131.94.134.13 -> 131.94.132.160 TCP ssh > 49477 [SYN, ACK] Seq=0 Ack=1 Win=5840 Len=0 MSS=1460 WS=5
  0.002000 131.94.132.160 -> 131.94.134.13 TCP 49477 > ssh [ACK] Seq=1 Ack=1 Win=65536 Len=0
  0.092986 131.94.134.13 -> 131.94.132.160 SSH Server Protocol: SSH-2.0-OpenSSH_4.3
  0.093986 131.94.132.160 -> 131.94.134.13 SSH Client Protocol: SSH-2.0-PuTTY_Release_0.63\r
  0.093986 131.94.132.160 -> 131.94.134.13 SSHv2 Client: Key Exchange Init
  0.094986 131.94.134.13 -> 131.94.132.160 TCP ssh > 49477 [ACK] Seq=21 Ack=29 Win=5856 Len=0
  0.094986 131.94.134.13 -> 131.94.132.160 TCP ssh > 49477 [ACK] Seq=21 Ack=701 Win=7200 Len=0
  0.103984 131.94.134.13 -> 131.94.132.160 SSHv2 Server: Key Exchange Init
  0.105984 131.94.132.160 -> 131.94.134.13 SSHv2 Client: Diffie-Hellman Key Exchange Init
  0.123981 131.94.134.13 -> 131.94.132.160 SSHv2 Server: Diffie-Hellman Key Exchange Reply
  0.149977 131.94.132.160 -> 131.94.134.13 SSHv2 Client: Diffie-Hellman GEX Init
  0.169838 131.94.134.13 -> 131.94.132.160 SSHv2 Server: Diffie-Hellman GEX Reply
  0.224966 131.94.132.160 -> 131.94.134.13 TCP 49477 > ssh [ACK] Seq=989 Ack=1853 Win=65536 Len=0
  0.599909 131.94.132.160 -> 131.94.134.13 SSHv2 Client: New Keys
  0.599909 131.94.132.160 -> 131.94.134.13 SSHv2 Encrypted request packet len=52
  0.601154 131.94.134.13 -> 131.94.132.160 TCP ssh > 49477 [ACK] Seq=1853 Ack=1057 Win=8544 Len=0
  0.601650 131.94.134.13 -> 131.94.132.160 SSHv2 Encrypted response packet len=52
  0.661899 131.94.132.160 -> 131.94.134.13 TCP 49477 > ssh [ACK] Seq=1057 Ack=1905 Win=65536 Len=0
  1.489774 131.94.132.160 -> 131.94.134.13 SSHv2 Encrypted request packet len=68
  1.495207 131.94.134.13 -> 131.94.132.160 SSHv2 Encrypted response packet len=84
  1.496773 131.94.132.160 -> 131.94.134.13 SSHv2 Encrypted request packet len=100
  1.518769 131.94.134.13 -> 131.94.134.129 DNS Standard query PTR 160.132.94.131.in-addr.arpa
  1.519769 131.94.134.129 -> 131.94.134.13 DNS Standard query response PTR instructor134.aul.fiu.edu
  1.520769 131.94.134.13 -> 131.94.134.129 DNS Standard query A instructor134.aul.fiu.edu
  1.521769 131.94.134.129 -> 131.94.134.13 DNS Standard query response A 131.94.132.160
  1.537766 131.94.134.13 -> 131.94.132.160 TCP ssh > 49477 [ACK] Seq=1989 Ack=1225 Win=8544 Len=0
  1.723738 131.94.186.14 -> 131.94.134.13 TCP 22678 > http [SYN] Seq=0 Win=8192 Len=0 MSS=1460 WS=8
  1.723738 131.94.134.13 -> 131.94.186.14 TCP http > 22678 [SYN, ACK] Seq=0 Ack=1 Win=5840 Len=0 MSS=1460 WS=5
  1.725738 131.94.186.14 -> 131.94.134.13 TCP 22678 > http [ACK] Seq=1 Ack=1 Win=65536 Len=0
  1.726738 131.94.186.14 -> 131.94.134.13 HTTP GET /wordpress/wp-login.php HTTP/1.1 
  1.726738 131.94.134.13 -> 131.94.186.14 TCP http > 22678 [ACK] Seq=1 Ack=310 Win=6912 Len=0
  2.021693 Vmware_d6:f3:a1 -> Broadcast    ARP Who has 131.194.134.1?  Tell 131.194.134.16
  2.098104 131.94.134.13 -> 131.94.132.160 SSHv2 Encrypted response packet len=84
  2.182668 131.94.132.160 -> 131.94.134.13 TCP 49477 > ssh [ACK] Seq=1225 Ack=2073 Win=65280 Len=0
  2.760580 131.94.134.13 -> 131.94.186.14 HTTP HTTP/1.1 200 OK  (text/html)
  2.761580 131.94.134.13 -> 131.94.186.14 HTTP Continuation or non-HTTP traffic
  2.761580 131.94.134.13 -> 131.94.186.14 TCP http > 22678 [FIN, ACK] Seq=3069 Ack=310 Win=6912 Len=0
  2.775578 131.94.186.14 -> 131.94.134.13 TCP 22678 > http [ACK] Seq=310 Ack=2921 Win=65536 Len=0
  2.777578 131.94.186.14 -> 131.94.134.13 TCP 22678 > http [ACK] Seq=310 Ack=3070 Win=65536 Len=0
  2.782577 131.94.186.14 -> 131.94.134.13 TCP 22678 > http [FIN, ACK] Seq=310 Ack=3070 Win=65536 Len=0
  2.782577 131.94.134.13 -> 131.94.186.14 TCP http > 22678 [ACK] Seq=3070 Ack=311 Win=6912 Len=0
  2.824571 131.94.186.14 -> 131.94.134.13 TCP 22359 > http [SYN] Seq=0 Win=8192 Len=0 MSS=1460 WS=8
  2.824571 131.94.134.13 -> 131.94.186.14 TCP http > 22359 [SYN, ACK] Seq=0 Ack=1 Win=5840 Len=0 MSS=1460 WS=5
  2.824571 131.94.186.14 -> 131.94.134.13 TCP 16089 > http [SYN] Seq=0 Win=8192 Len=0 MSS=1460 WS=8
  2.824571 131.94.134.13 -> 131.94.186.14 TCP http > 16089 [SYN, ACK] Seq=0 Ack=1 Win=5840 Len=0 MSS=1460 WS=5
  2.824571 131.94.186.14 -> 131.94.134.13 TCP 14528 > http [SYN] Seq=0 Win=8192 Len=0 MSS=1460 WS=8
  2.825571 131.94.134.13 -> 131.94.186.14 TCP http > 14528 [SYN, ACK] Seq=0 Ack=1 Win=5840 Len=0 MSS=1460 WS=5
  2.827570 131.94.186.14 -> 131.94.134.13 TCP 22359 > http [ACK] Seq=1 Ack=1 Win=65536 Len=0
  2.827570 131.94.186.14 -> 131.94.134.13 TCP 16089 > http [ACK] Seq=1 Ack=1 Win=65536 Len=0
  2.830570 131.94.186.14 -> 131.94.134.13 HTTP GET /wordpress/wp-includes/css/buttons.min.css?ver=4.0 HTTP/1.1 
  2.830570 131.94.134.13 -> 131.94.186.14 TCP http > 22359 [ACK] Seq=1 Ack=393 Win=6912 Len=0
  2.832569 131.94.186.14 -> 131.94.134.13 TCP 9262 > http [SYN] Seq=0 Win=8192 Len=0 MSS=1460 WS=8
  2.832569 131.94.134.13 -> 131.94.186.14 TCP http > 9262 [SYN, ACK] Seq=0 Ack=1 Win=5840 Len=0 MSS=1460 WS=5
  2.832569 131.94.186.14 -> 131.94.134.13 HTTP GET /wordpress/wp-includes/css/dashicons.min.css?ver=4.0 HTTP/1.1 
  2.832569 131.94.134.13 -> 131.94.186.14 TCP http > 16089 [ACK] Seq=1 Ack=395 Win=6912 Len=0
  2.833569 131.94.186.14 -> 131.94.134.13 TCP 14528 > http [ACK] Seq=1 Ack=1 Win=65536 Len=0
  2.834569 131.94.134.13 -> 131.94.186.14 HTTP HTTP/1.1 200 OK  (text/css)
  2.834569 131.94.134.13 -> 131.94.186.14 HTTP Continuation or non-HTTP traffic
  2.835569 131.94.134.13 -> 131.94.186.14 HTTP Continuation or non-HTTP traffic
  2.835569 131.94.186.14 -> 131.94.134.13 TCP 24239 > http [SYN] Seq=0 Win=8192 Len=0 MSS=1460 WS=8
  2.835569 131.94.134.13 -> 131.94.186.14 TCP http > 24239 [SYN, ACK] Seq=0 Ack=1 Win=5840 Len=0 MSS=1460 WS=5
  2.835569 131.94.134.13 -> 131.94.186.14 HTTP Continuation or non-HTTP traffic
  2.835569 131.94.134.13 -> 131.94.186.14 HTTP HTTP/1.1 200 OK  (text/css)
  2.835569 131.94.134.13 -> 131.94.186.14 HTTP Continuation or non-HTTP traffic
  2.837569 131.94.186.14 -> 131.94.134.13 HTTP GET /wordpress/wp-admin/css/login.min.css?ver=4.0 HTTP/1.1 
  2.837569 131.94.134.13 -> 131.94.186.14 TCP http > 14528 [ACK] Seq=1 Ack=388 Win=6912 Len=0
  2.840568 131.94.186.14 -> 131.94.134.13 TCP 24239 > http [ACK] Seq=1 Ack=1 Win=65536 Len=0
  2.841568 131.94.186.14 -> 131.94.134.13 TCP 9262 > http [ACK] Seq=1 Ack=1 Win=65536 Len=0
  2.845567 131.94.186.14 -> 131.94.134.13 TCP 16089 > http [ACK] Seq=395 Ack=2921 Win=65536 Len=0
  2.845567 131.94.134.13 -> 131.94.186.14 HTTP Continuation or non-HTTP traffic
  2.846567 131.94.186.14 -> 131.94.134.13 TCP 22359 > http [ACK] Seq=393 Ack=2921 Win=65536 Len=0
  2.846567 131.94.186.14 -> 131.94.134.13 TCP 22359 > http [ACK] Seq=393 Ack=5841 Win=65536 Len=0
  2.846567 131.94.186.14 -> 131.94.134.13 TCP 22359 > http [ACK] Seq=393 Ack=6235 Win=65280 Len=0
  2.848567 131.94.186.14 -> 131.94.134.13 TCP 16089 > http [ACK] Seq=395 Ack=5841 Win=65536 Len=0
  2.848567 131.94.134.13 -> 131.94.186.14 HTTP Continuation or non-HTTP traffic
  2.849567 131.94.186.14 -> 131.94.134.13 TCP 16089 > http [ACK] Seq=395 Ack=8761 Win=65536 Len=0
  2.849567 131.94.134.13 -> 131.94.186.14 HTTP Continuation or non-HTTP traffic
  2.849567 131.94.186.14 -> 131.94.134.13 TCP 22359 > http [FIN, ACK] Seq=393 Ack=6235 Win=65280 Len=0
  2.849567 131.94.134.13 -> 131.94.186.14 TCP http > 22359 [ACK] Seq=6235 Ack=394 Win=6912 Len=0
  2.857566 131.94.186.14 -> 131.94.134.13 TCP 16089 > http [ACK] Seq=395 Ack=11681 Win=65536 Len=0
  2.857566 131.94.134.13 -> 131.94.186.14 HTTP Continuation or non-HTTP traffic
  2.857566 131.94.186.14 -> 131.94.134.13 TCP 16089 > http [ACK] Seq=395 Ack=14601 Win=65536 Len=0
  2.857566 131.94.134.13 -> 131.94.186.14 HTTP Continuation or non-HTTP traffic
  2.857566 131.94.186.14 -> 131.94.134.13 TCP 16089 > http [ACK] Seq=395 Ack=17521 Win=65536 Len=0
  2.857566 131.94.134.13 -> 131.94.186.14 HTTP Continuation or non-HTTP traffic
  2.864565 131.94.186.14 -> 131.94.134.13 TCP 16089 > http [ACK] Seq=395 Ack=20441 Win=65536 Len=0
  2.865564 131.94.186.14 -> 131.94.134.13 TCP 16089 > http [ACK] Seq=395 Ack=23361 Win=65536 Len=0
  2.865564 131.94.134.13 -> 131.94.186.14 HTTP Continuation or non-HTTP traffic
  2.865564 131.94.186.14 -> 131.94.134.13 TCP 16089 > http [ACK] Seq=395 Ack=26281 Win=65536 Len=0
  2.865564 131.94.186.14 -> 131.94.134.13 TCP 16089 > http [ACK] Seq=395 Ack=29201 Win=65536 Len=0
  2.865564 131.94.134.13 -> 131.94.186.14 HTTP Continuation or non-HTTP traffic
  2.865564 131.94.134.13 -> 131.94.186.14 HTTP Continuation or non-HTTP traffic
  2.866564 131.94.134.13 -> 131.94.186.14 TCP http > 16089 [FIN, ACK] Seq=40706 Ack=395 Win=6912 Len=0
  2.873563 131.94.186.14 -> 131.94.134.13 TCP 16089 > http [ACK] Seq=395 Ack=32121 Win=65536 Len=0
  2.873563 131.94.186.14 -> 131.94.134.13 TCP 16089 > http [ACK] Seq=395 Ack=35041 Win=65536 Len=0
  2.873563 131.94.186.14 -> 131.94.134.13 TCP 16089 > http [ACK] Seq=395 Ack=37961 Win=65536 Len=0
  2.874563 131.94.186.14 -> 131.94.134.13 TCP 16089 > http [ACK] Seq=395 Ack=40706 Win=65536 Len=0
  2.875563 131.94.186.14 -> 131.94.134.13 TCP 16089 > http [ACK] Seq=395 Ack=40707 Win=65536 Len=0
  2.881562 131.94.186.14 -> 131.94.134.13 TCP 16089 > http [FIN, ACK] Seq=395 Ack=40707 Win=65536 Len=0
  2.881562 131.94.134.13 -> 131.94.186.14 TCP http > 16089 [ACK] Seq=40707 Ack=396 Win=6912 Len=0
  2.899559 131.94.134.13 -> 131.94.186.14 HTTP HTTP/1.1 200 OK  (text/css)
  2.899559 131.94.134.13 -> 131.94.186.14 HTTP Continuation or non-HTTP traffic
  2.900559 131.94.134.13 -> 131.94.186.14 HTTP Continuation or non-HTTP traffic
  2.900559 131.94.134.13 -> 131.94.186.14 HTTP Continuation or non-HTTP traffic
  2.900559 131.94.134.13 -> 131.94.186.14 HTTP Continuation or non-HTTP traffic
  2.900559 131.94.134.13 -> 131.94.186.14 HTTP Continuation or non-HTTP traffic
  2.901559 131.94.134.13 -> 131.94.186.14 HTTP Continuation or non-HTTP traffic
  2.901559 131.94.134.13 -> 131.94.186.14 HTTP Continuation or non-HTTP traffic
  2.901559 131.94.134.13 -> 131.94.186.14 HTTP Continuation or non-HTTP traffic
  2.901559 131.94.134.13 -> 131.94.186.14 HTTP Continuation or non-HTTP traffic
  2.901559 131.94.134.13 -> 131.94.186.14 HTTP Continuation or non-HTTP traffic
  2.902559 131.94.134.13 -> 131.94.186.14 HTTP Continuation or non-HTTP traffic
  2.902559 131.94.134.13 -> 131.94.186.14 HTTP Continuation or non-HTTP traffic
  2.911557 131.94.186.14 -> 131.94.134.13 TCP 14528 > http [ACK] Seq=388 Ack=2921 Win=65536 Len=0
  2.911557 131.94.186.14 -> 131.94.134.13 TCP 14528 > http [ACK] Seq=388 Ack=5841 Win=65536 Len=0
  2.914557 131.94.186.14 -> 131.94.134.13 TCP 14528 > http [ACK] Seq=388 Ack=8761 Win=65536 Len=0
  2.914557 131.94.186.14 -> 131.94.134.13 TCP 14528 > http [ACK] Seq=388 Ack=11681 Win=65536 Len=0
  2.915557 131.94.186.14 -> 131.94.134.13 TCP 14528 > http [ACK] Seq=388 Ack=14601 Win=65536 Len=0
  2.915557 131.94.186.14 -> 131.94.134.13 TCP 14528 > http [ACK] Seq=388 Ack=17521 Win=65536 Len=0
  2.915557 131.94.186.14 -> 131.94.134.13 TCP 14528 > http [ACK] Seq=388 Ack=19037 Win=65536 Len=0
  2.924555 131.94.186.14 -> 131.94.134.13 TCP 14528 > http [FIN, ACK] Seq=388 Ack=19037 Win=65536 Len=0
  2.925555 131.94.134.13 -> 131.94.186.14 TCP http > 14528 [ACK] Seq=19037 Ack=389 Win=6912 Len=0
  2.926555 131.94.186.14 -> 131.94.134.13 HTTP GET /wordpress/wp-admin/images/wordpress-logo.svg?ver=20131107 HTTP/1.1 
  2.926555 131.94.134.13 -> 131.94.186.14 TCP http > 9262 [ACK] Seq=1 Ack=438 Win=6912 Len=0
  2.929555 131.94.134.13 -> 131.94.186.14 HTTP HTTP/1.1 200 OK  (text/plain)
  2.929555 131.94.134.13 -> 131.94.186.14 HTTP Continuation or non-HTTP traffic
  2.929555 131.94.134.13 -> 131.94.186.14 TCP http > 9262 [FIN, ACK] Seq=1792 Ack=438 Win=6912 Len=0
  2.931554 131.94.186.14 -> 131.94.134.13 TCP 9262 > http [ACK] Seq=438 Ack=1792 Win=65536 Len=0
  2.931554 131.94.186.14 -> 131.94.134.13 TCP 9262 > http [ACK] Seq=438 Ack=1793 Win=65536 Len=0
  2.931554 131.94.186.14 -> 131.94.134.13 TCP 9262 > http [FIN, ACK] Seq=438 Ack=1793 Win=65536 Len=0
  2.931554 131.94.134.13 -> 131.94.186.14 TCP http > 9262 [ACK] Seq=1793 Ack=439 Win=6912 Len=0
  2.959550 131.94.186.14 -> 131.94.134.13 HTTP GET /favicon.ico HTTP/1.1 
  2.959550 131.94.134.13 -> 131.94.186.14 TCP http > 24239 [ACK] Seq=1 Ack=299 Win=6912 Len=0
  2.961550 131.94.134.13 -> 131.94.186.14 HTTP HTTP/1.1 404 Not Found  (text/html)
  2.961550 131.94.134.13 -> 131.94.186.14 TCP http > 24239 [FIN, ACK] Seq=467 Ack=299 Win=6912 Len=0
  2.966549 131.94.186.14 -> 131.94.134.13 TCP 24239 > http [ACK] Seq=299 Ack=468 Win=65024 Len=0
  2.967549 131.94.186.14 -> 131.94.134.13 TCP 24239 > http [FIN, ACK] Seq=299 Ack=468 Win=65024 Len=0
  2.967549 131.94.134.13 -> 131.94.186.14 TCP http > 24239 [ACK] Seq=468 Ack=300 Win=6912 Len=0
  2.976548 131.94.186.14 -> 131.94.134.13 TCP 59140 > http [SYN] Seq=0 Win=8192 Len=0 MSS=1460 WS=8
  2.976548 131.94.134.13 -> 131.94.186.14 TCP http > 59140 [SYN, ACK] Seq=0 Ack=1 Win=5840 Len=0 MSS=1460 WS=5
  2.979547 131.94.186.14 -> 131.94.134.13 TCP 59140 > http [ACK] Seq=1 Ack=1 Win=65536 Len=0
  2.980547 131.94.186.14 -> 131.94.134.13 HTTP GET /favicon.ico HTTP/1.1 
  2.980547 131.94.134.13 -> 131.94.186.14 TCP http > 59140 [ACK] Seq=1 Ack=299 Win=6912 Len=0
  2.981547 131.94.134.13 -> 131.94.186.14 HTTP HTTP/1.1 404 Not Found  (text/html)
  2.982547 131.94.134.13 -> 131.94.186.14 TCP http > 59140 [FIN, ACK] Seq=467 Ack=299 Win=6912 Len=0
  2.990545 131.94.186.14 -> 131.94.134.13 TCP 59140 > http [FIN, ACK] Seq=299 Ack=467 Win=65024 Len=0
  2.990545 131.94.134.13 -> 131.94.186.14 TCP http > 59140 [ACK] Seq=468 Ack=300 Win=6912 Len=0
  2.990545 131.94.186.14 -> 131.94.134.13 TCP 59140 > http [ACK] Seq=300 Ack=468 Win=65024 Len=0
  3.350491 Vmware_d6:f3:a1 -> Broadcast    ARP Who has 131.194.134.1?  Tell 131.194.134.16
  3.403483 131.94.132.160 -> 131.94.134.13 SSHv2 Encrypted request packet len=296
  3.403483 131.94.134.13 -> 131.94.132.160 TCP ssh > 49477 [ACK] Seq=2073 Ack=1521 Win=9888 Len=0
  4.376335 Vmware_d6:f3:a1 -> Broadcast    ARP Who has 131.194.134.1?  Tell 131.194.134.16
  5.868108 131.94.134.13 -> 131.94.134.129 DNS Standard query A instructor134.aul.fiu.edu
  5.868108 131.94.134.129 -> 131.94.134.13 DNS Standard query response A 131.94.132.160
  5.870291 131.94.134.13 -> 131.94.132.160 SSHv2 Encrypted response packet len=84
  5.926099 131.94.132.160 -> 131.94.134.13 TCP 49477 > ssh [ACK] Seq=1521 Ack=2157 Win=65280 Len=0
  6.364033 131.94.186.14 -> 131.94.134.13 TCP 64662 > http [SYN] Seq=0 Win=8192 Len=0 MSS=1460 WS=8
  6.364033 131.94.134.13 -> 131.94.186.14 TCP http > 64662 [SYN, ACK] Seq=0 Ack=1 Win=5840 Len=0 MSS=1460 WS=5
  6.368032 131.94.186.14 -> 131.94.134.13 TCP 64662 > http [ACK] Seq=1 Ack=1 Win=65536 Len=0
  6.373031 131.94.186.14 -> 131.94.134.13 HTTP POST /wordpress/wp-login.php HTTP/1.1  (application/x-www-form-urlencoded)
  6.373031 131.94.134.13 -> 131.94.186.14 TCP http > 64662 [ACK] Seq=1 Ack=604 Win=7072 Len=0
  6.630992 131.94.134.13 -> 131.94.186.14 HTTP HTTP/1.1 302 Found 
  6.643990 131.94.134.13 -> 131.94.186.14 TCP http > 64662 [FIN, ACK] Seq=1136 Ack=604 Win=7072 Len=0
  6.653989 131.94.186.14 -> 131.94.134.13 TCP 64662 > http [ACK] Seq=604 Ack=1137 Win=64512 Len=0
  6.662987 131.94.186.14 -> 131.94.134.13 TCP 64662 > http [FIN, ACK] Seq=604 Ack=1137 Win=64512 Len=0
  6.662987 131.94.134.13 -> 131.94.186.14 TCP http > 64662 [ACK] Seq=1137 Ack=605 Win=7072 Len=0
  6.674985 131.94.186.14 -> 131.94.134.13 TCP 51600 > http [SYN] Seq=0 Win=8192 Len=0 MSS=1460 WS=8
  6.674985 131.94.134.13 -> 131.94.186.14 TCP http > 51600 [SYN, ACK] Seq=0 Ack=1 Win=5840 Len=0 MSS=1460 WS=5
  6.687983 131.94.186.14 -> 131.94.134.13 TCP 51600 > http [ACK] Seq=1 Ack=1 Win=65536 Len=0
  6.695982 131.94.186.14 -> 131.94.134.13 HTTP GET /wordpress/wp-admin/ HTTP/1.1 
  6.695982 131.94.134.13 -> 131.94.186.14 TCP http > 51600 [ACK] Seq=1 Ack=768 Win=7392 Len=0
  7.156912 131.94.134.13 -> 131.94.134.129 DNS Standard query A api.wordpress.org
  7.158912 131.94.134.129 -> 131.94.134.13 DNS Standard query response A 66.155.40.202 A 66.155.40.203 A 66.155.40.249 A 66.155.40.250
  7.159912 131.94.134.13 -> 131.94.134.129 DNS Standard query A api.wordpress.org
  7.160911 131.94.134.129 -> 131.94.134.13 DNS Standard query response A 66.155.40.250 A 66.155.40.202 A 66.155.40.203 A 66.155.40.249
  7.162911 131.94.134.13 -> 66.155.40.250 TCP 59750 > http [SYN] Seq=0 Win=5840 Len=0 MSS=1460 TSV=104595694 TSER=0 WS=5
  7.200905 66.155.40.250 -> 131.94.134.13 TCP http > 59750 [SYN, ACK] Seq=0 Ack=1 Win=28960 Len=0 MSS=1460 TSV=716001371 TSER=104595694 WS=9
  7.200905 131.94.134.13 -> 66.155.40.250 TCP 59750 > http [ACK] Seq=1 Ack=1 Win=5856 Len=0 TSV=104595732 TSER=716001371
  7.200905 131.94.134.13 -> 66.155.40.250 HTTP POST /core/browse-happy/1.1/ HTTP/1.0  (application/x-www-form-urlencoded)
  7.233900 66.155.40.250 -> 131.94.134.13 TCP http > 59750 [ACK] Seq=1 Ack=369 Win=30208 Len=0 TSV=716001394 TSER=104595732
  7.234900 66.155.40.250 -> 131.94.134.13 TCP [TCP segment of a reassembled PDU]
  7.234900 131.94.134.13 -> 66.155.40.250 TCP 59750 > http [ACK] Seq=369 Ack=476 Win=6912 Len=0 TSV=104595766 TSER=716001394
  7.234900 66.155.40.250 -> 131.94.134.13 HTTP HTTP/1.1 200 OK  (text/html)
  7.234900 131.94.134.13 -> 66.155.40.250 TCP 59750 > http [FIN, ACK] Seq=369 Ack=477 Win=6912 Len=0 TSV=104595766 TSER=716001394
  7.239899 66.155.40.250 -> 131.94.134.13 TCP http > 59750 [ACK] Seq=477 Ack=370 Win=30208 Len=0 TSV=716001425 TSER=104595766
  7.263896 131.94.134.13 -> 131.94.186.14 HTTP HTTP/1.1 200 OK [Unreassembled Packet [incorrect TCP checksum]] 
  7.303890 131.94.186.14 -> 131.94.134.13 TCP 51600 > http [ACK] Seq=768 Ack=2921 Win=65536 Len=0
  7.303890 131.94.134.13 -> 131.94.186.14 HTTP Continuation or non-HTTP traffic
  7.324125 131.94.186.14 -> 131.94.134.13 TCP 51600 > http [ACK] Seq=768 Ack=5841 Win=65536 Len=0
  7.324368 131.94.134.13 -> 131.94.186.14 HTTP Continuation or non-HTTP traffic
  7.324417 131.94.186.14 -> 131.94.134.13 TCP 51600 > http [ACK] Seq=768 Ack=8761 Win=65536 Len=0
  7.324467 131.94.134.13 -> 131.94.186.14 HTTP Continuation or non-HTTP traffic
  7.331913 131.94.186.14 -> 131.94.134.13 TCP [TCP Dup ACK 192#1] 51600 > http [ACK] Seq=768 Ack=8761 Win=65536 Len=0 SLE=10221 SRE=11681
  7.331947 131.94.134.13 -> 131.94.186.14 HTTP Continuation or non-HTTP traffic
  7.331966 131.94.186.14 -> 131.94.134.13 TCP [TCP Dup ACK 192#2] 51600 > http [ACK] Seq=768 Ack=8761 Win=65536 Len=0 SLE=10221 SRE=13141
  7.331989 131.94.134.13 -> 131.94.186.14 HTTP Continuation or non-HTTP traffic
  7.332035 131.94.186.14 -> 131.94.134.13 TCP [TCP Dup ACK 192#3] 51600 > http [ACK] Seq=768 Ack=8761 Win=65536 Len=0 SLE=10221 SRE=14601
  7.332054 131.94.134.13 -> 131.94.186.14 HTTP Continuation or non-HTTP traffic
  7.332151 131.94.186.14 -> 131.94.134.13 TCP 51600 > http [ACK] Seq=768 Ack=14601 Win=65536 Len=0
  7.332166 131.94.186.14 -> 131.94.134.13 TCP 51600 > http [ACK] Seq=768 Ack=17521 Win=65536 Len=0
  7.332177 131.94.134.13 -> 131.94.186.14 HTTP Continuation or non-HTTP traffic
  7.332893 131.94.134.13 -> 131.94.186.14 HTTP Continuation or non-HTTP traffic
  7.334891 131.94.186.14 -> 131.94.134.13 TCP 51600 > http [ACK] Seq=768 Ack=20441 Win=65536 Len=0
  7.336572 131.94.186.14 -> 131.94.134.13 TCP 51600 > http [ACK] Seq=768 Ack=21901 Win=65536 Len=0 SLE=23361 SRE=24821
  7.336593 131.94.186.14 -> 131.94.134.13 TCP [TCP Dup ACK 205#1] 51600 > http [ACK] Seq=768 Ack=21901 Win=65536 Len=0 SLE=23361 SRE=25766
  7.337174 131.94.186.14 -> 131.94.134.13 TCP 51600 > http [ACK] Seq=768 Ack=25766 Win=65536 Len=0
  7.418581 131.94.134.13 -> 131.94.186.14 HTTP Continuation or non-HTTP traffic
  7.419098 131.94.134.13 -> 131.94.186.14 HTTP Continuation or non-HTTP traffic
  7.433272 131.94.134.13 -> 131.94.186.14 HTTP Continuation or non-HTTP traffic
  7.471664 131.94.186.14 -> 131.94.134.13 TCP 51600 > http [ACK] Seq=768 Ack=28686 Win=65536 Len=0
  7.472011 131.94.186.14 -> 131.94.134.13 TCP 51600 > http [ACK] Seq=768 Ack=31606 Win=65536 Len=0
  7.472027 131.94.134.13 -> 131.94.186.14 HTTP Continuation or non-HTTP traffic
  7.472325 131.94.134.13 -> 131.94.186.14 HTTP Continuation or non-HTTP traffic
  7.474537 131.94.186.14 -> 131.94.134.13 TCP 51600 > http [ACK] Seq=768 Ack=34250 Win=65536 Len=0
  7.474903 131.94.186.14 -> 131.94.134.13 TCP 51600 > http [ACK] Seq=768 Ack=37170 Win=65536 Len=0
  7.484869 131.94.186.14 -> 131.94.134.13 TCP 51600 > http [ACK] Seq=768 Ack=40090 Win=65536 Len=0
  7.484914 131.94.186.14 -> 131.94.134.13 TCP 51600 > http [ACK] Seq=768 Ack=42645 Win=65536 Len=0
  7.488931 131.94.134.13 -> 131.94.186.14 HTTP Continuation or non-HTTP traffic
  7.489295 131.94.134.13 -> 131.94.186.14 TCP http > 51600 [FIN, ACK] Seq=42803 Ack=768 Win=7392 Len=0
  7.493931 131.94.186.14 -> 131.94.134.13 TCP [TCP Dup ACK 218#1] 51600 > http [ACK] Seq=768 Ack=42645 Win=65536 Len=0
  7.495092 131.94.186.14 -> 131.94.134.13 TCP 51600 > http [ACK] Seq=768 Ack=42804 Win=65536 Len=0
  7.513994 131.94.186.14 -> 131.94.134.13 TCP 51600 > http [FIN, ACK] Seq=768 Ack=42804 Win=65536 Len=0
  7.514026 131.94.134.13 -> 131.94.186.14 TCP http > 51600 [ACK] Seq=42804 Ack=769 Win=7392 Len=0
  7.544182 131.94.186.14 -> 131.94.134.13 TCP 10802 > http [SYN] Seq=0 Win=8192 Len=0 MSS=1460 WS=8
  7.544232 131.94.134.13 -> 131.94.186.14 TCP http > 10802 [SYN, ACK] Seq=0 Ack=1 Win=5840 Len=0 MSS=1460 WS=5
  7.544584 131.94.186.14 -> 131.94.134.13 TCP everydayrc > http [SYN] Seq=0 Win=8192 Len=0 MSS=1460 WS=8
  7.544635 131.94.134.13 -> 131.94.186.14 TCP http > everydayrc [SYN, ACK] Seq=0 Ack=1 Win=5840 Len=0 MSS=1460 WS=5
  7.545129 131.94.186.14 -> 131.94.134.13 TCP 56313 > http [SYN] Seq=0 Win=8192 Len=0 MSS=1460 WS=8
  7.545150 131.94.134.13 -> 131.94.186.14 TCP http > 56313 [SYN, ACK] Seq=0 Ack=1 Win=5840 Len=0 MSS=1460 WS=5
  7.545572 131.94.186.14 -> 131.94.134.13 TCP 34514 > http [SYN] Seq=0 Win=8192 Len=0 MSS=1460 WS=8
  7.545590 131.94.134.13 -> 131.94.186.14 TCP http > 34514 [SYN, ACK] Seq=0 Ack=1 Win=5840 Len=0 MSS=1460 WS=5
  7.552122 131.94.186.14 -> 131.94.134.13 TCP 10802 > http [ACK] Seq=1 Ack=1 Win=65536 Len=0
  7.552153 131.94.186.14 -> 131.94.134.13 TCP 56313 > http [ACK] Seq=1 Ack=1 Win=65536 Len=0
  7.552286 131.94.186.14 -> 131.94.134.13 TCP everydayrc > http [ACK] Seq=1 Ack=1 Win=65536 Len=0
  7.552706 131.94.186.14 -> 131.94.134.13 TCP 34514 > http [ACK] Seq=1 Ack=1 Win=65536 Len=0
  7.553023 131.94.186.14 -> 131.94.134.13 TCP 25967 > http [SYN] Seq=0 Win=8192 Len=0 MSS=1460 WS=8
  7.553059 131.94.134.13 -> 131.94.186.14 TCP http > 25967 [SYN, ACK] Seq=0 Ack=1 Win=5840 Len=0 MSS=1460 WS=5
  7.553373 131.94.186.14 -> 131.94.134.13 HTTP GET /wordpress/wp-admin/load-scripts.php?c=1&load%5B%5D=jquery-core,jquery-migrate,utils,json2&ver=4.0 HTTP/1.1 
  7.553415 131.94.134.13 -> 131.94.186.14 TCP http > 56313 [ACK] Seq=1 Ack=814 Win=7488 Len=0
  7.553746 131.94.186.14 -> 131.94.134.13 TCP 52526 > http [SYN] Seq=0 Win=8192 Len=0 MSS=1460 WS=8
  7.554052 131.94.134.13 -> 131.94.186.14 TCP http > 52526 [SYN, ACK] Seq=0 Ack=1 Win=5840 Len=0 MSS=1460 WS=5
  7.554088 131.94.186.14 -> 131.94.134.13 HTTP GET /wordpress/wp-includes/js/thickbox/thickbox.css?ver=4.0 HTTP/1.1 
  7.554110 131.94.134.13 -> 131.94.186.14 TCP http > 10802 [ACK] Seq=1 Ack=611 Win=7072 Len=0
  7.554275 131.94.186.14 -> 131.94.134.13 HTTP GET /wordpress/wp-admin/load-styles.php?c=1&dir=ltr&load=dashicons,admin-bar,wp-admin,buttons,wp-auth-check&ver=4.0 HTTP/1.1 
  7.554309 131.94.134.13 -> 131.94.186.14 TCP http > everydayrc [ACK] Seq=1 Ack=842 Win=7552 Len=0
  7.554543 131.94.186.14 -> 131.94.134.13 HTTP GET /wordpress/wp-includes/css/editor.min.css?ver=4.0 HTTP/1.1 
  7.554564 131.94.134.13 -> 131.94.186.14 TCP http > 34514 [ACK] Seq=1 Ack=605 Win=7072 Len=0
  7.564850 131.94.134.13 -> 131.94.186.14 HTTP HTTP/1.1 200 OK  (text/css)
  7.565850 131.94.134.13 -> 131.94.186.14 HTTP Continuation or non-HTTP traffic
  7.565850 131.94.134.13 -> 131.94.186.14 HTTP Continuation or non-HTTP traffic
  7.565850 131.94.134.13 -> 131.94.186.14 HTTP Continuation or non-HTTP traffic
  7.565850 131.94.134.13 -> 131.94.186.14 HTTP Continuation or non-HTTP traffic
  7.566850 131.94.134.13 -> 131.94.186.14 HTTP Continuation or non-HTTP traffic
  7.566850 131.94.134.13 -> 131.94.186.14 HTTP Continuation or non-HTTP traffic
  7.566850 131.94.134.13 -> 131.94.186.14 HTTP Continuation or non-HTTP traffic
  7.566850 131.94.134.13 -> 131.94.186.14 HTTP Continuation or non-HTTP traffic
  7.566850 131.94.134.13 -> 131.94.186.14 HTTP Continuation or non-HTTP traffic
  7.567850 131.94.134.13 -> 131.94.186.14 HTTP Continuation or non-HTTP traffic
  7.567850 131.94.134.13 -> 131.94.186.14 HTTP Continuation or non-HTTP traffic
  7.567850 131.94.134.13 -> 131.94.186.14 HTTP Continuation or non-HTTP traffic
  7.567850 131.94.134.13 -> 131.94.186.14 HTTP Continuation or non-HTTP traffic
  7.567850 131.94.134.13 -> 131.94.186.14 HTTP Continuation or non-HTTP traffic
  7.567850 131.94.134.13 -> 131.94.186.14 HTTP Continuation or non-HTTP traffic
  7.567850 131.94.134.13 -> 131.94.186.14 HTTP Continuation or non-HTTP traffic
  7.567850 131.94.134.13 -> 131.94.186.14 HTTP Continuation or non-HTTP traffic
  7.568946 131.94.186.14 -> 131.94.134.13 TCP 52526 > http [ACK] Seq=1 Ack=1 Win=65536 Len=0
  7.570862 131.94.186.14 -> 131.94.134.13 TCP 25967 > http [ACK] Seq=1 Ack=1 Win=65536 Len=0
  7.580848 131.94.134.13 -> 131.94.186.14 HTTP HTTP/1.1 200 OK  (text/css)
  7.581847 131.94.134.13 -> 131.94.186.14 HTTP Continuation or non-HTTP traffic
  7.581847 131.94.134.13 -> 131.94.186.14 TCP http > 10802 [FIN, ACK] Seq=2402 Ack=611 Win=7072 Len=0
  7.599860 131.94.186.14 -> 131.94.134.13 TCP 34514 > http [ACK] Seq=605 Ack=2921 Win=65536 Len=0
  7.599922 131.94.186.14 -> 131.94.134.13 TCP 34514 > http [ACK] Seq=605 Ack=5841 Win=65536 Len=0
  7.600218 131.94.186.14 -> 131.94.134.13 TCP [TCP Dup ACK 273#1] 34514 > http [ACK] Seq=605 Ack=5841 Win=65536 Len=0 SLE=11681 SRE=13141
  7.600232 131.94.186.14 -> 131.94.134.13 TCP [TCP Dup ACK 273#2] 34514 > http [ACK] Seq=605 Ack=5841 Win=65536 Len=0 SLE=10221 SRE=13141
  7.600237 131.94.186.14 -> 131.94.134.13 TCP [TCP Dup ACK 273#3] 34514 > http [ACK] Seq=605 Ack=5841 Win=65536 Len=0 SLE=10221 SRE=14601
  7.600453 131.94.186.14 -> 131.94.134.13 TCP [TCP Dup ACK 273#4] 34514 > http [ACK] Seq=605 Ack=5841 Win=65536 Len=0 SLE=10221 SRE=14601 SLE=16061 SRE=17521
  7.600463 131.94.186.14 -> 131.94.134.13 TCP [TCP Dup ACK 273#5] 34514 > http [ACK] Seq=605 Ack=5841 Win=65536 Len=0 SLE=16061 SRE=18981 SLE=10221 SRE=14601
  7.600467 131.94.186.14 -> 131.94.134.13 TCP [TCP Dup ACK 273#6] 34514 > http [ACK] Seq=605 Ack=5841 Win=65536 [TCP CHECKSUM INCORRECT] Len=0 SLE=16061 SRE=18981 SLE=20441 SRE=21901 SLE=16061 SRE=18981
  7.605940 131.94.186.14 -> 131.94.134.13 TCP 10802 > http [ACK] Seq=611 Ack=2402 Win=65536 Len=0
  7.605961 131.94.186.14 -> 131.94.134.13 TCP 10802 > http [ACK] Seq=611 Ack=2403 Win=65536 Len=0
  7.606210 131.94.186.14 -> 131.94.134.13 TCP 34514 > http [ACK] Seq=605 Ack=7301 Win=65536 Len=0 SLE=20441 SRE=21901 SLE=16061 SRE=18981 SLE=10221 SRE=14601
  7.607551 131.94.186.14 -> 131.94.134.13 TCP 34514 > http [ACK] Seq=605 Ack=8761 Win=65536 Len=0 SLE=20441 SRE=21901 SLE=16061 SRE=18981 SLE=10221 SRE=14601
  7.608365 131.94.186.14 -> 131.94.134.13 TCP 34514 > http [ACK] Seq=605 Ack=14601 Win=65536 Len=0 SLE=20441 SRE=21901 SLE=16061 SRE=18981
  7.609519 131.94.186.14 -> 131.94.134.13 TCP 34514 > http [ACK] Seq=605 Ack=18981 Win=65536 Len=0 SLE=20441 SRE=21901
  7.609537 131.94.186.14 -> 131.94.134.13 TCP 34514 > http [ACK] Seq=605 Ack=21901 Win=65536 Len=0
  7.609543 131.94.186.14 -> 131.94.134.13 TCP 34514 > http [ACK] Seq=605 Ack=23361 Win=65536 Len=0 SLE=24821 SRE=26281
  7.609548 131.94.186.14 -> 131.94.134.13 TCP [TCP Dup ACK 287#1] 34514 > http [ACK] Seq=605 Ack=23361 Win=65536 Len=0 SLE=24821 SRE=27281
  7.609998 131.94.186.14 -> 131.94.134.13 TCP 34514 > http [ACK] Seq=605 Ack=27282 Win=65536 Len=0
  7.615052 131.94.134.13 -> 131.94.186.14 HTTP HTTP/1.1 200 OK [Unreassembled Packet [incorrect TCP checksum]] 
  7.622243 131.94.186.14 -> 131.94.134.13 TCP 10802 > http [FIN, ACK] Seq=611 Ack=2403 Win=65536 Len=0
  7.622260 131.94.134.13 -> 131.94.186.14 TCP http > 10802 [ACK] Seq=2403 Ack=612 Win=7072 Len=0
  7.625854 131.94.186.14 -> 131.94.134.13 TCP 56313 > http [ACK] Seq=814 Ack=2921 Win=65536 Len=0
  7.625873 131.94.134.13 -> 131.94.186.14 HTTP Continuation or non-HTTP traffic
  7.629697 131.94.186.14 -> 131.94.134.13 TCP 56313 > http [ACK] Seq=814 Ack=4381 Win=65536 Len=0 SLE=1 SRE=1461
  7.629720 131.94.134.13 -> 131.94.186.14 HTTP Continuation or non-HTTP traffic
  7.630047 131.94.186.14 -> 131.94.134.13 TCP [TCP Dup ACK 295#1] 56313 > http [ACK] Seq=814 Ack=4381 Win=65536 Len=0 SLE=1461 SRE=2921
  7.630061 131.94.186.14 -> 131.94.134.13 TCP [TCP Dup ACK 295#2] 56313 > http [ACK] Seq=814 Ack=4381 Win=65536 Len=0 SLE=2921 SRE=4381
  7.631130 131.94.186.14 -> 131.94.134.13 TCP 34514 > http [FIN, ACK] Seq=605 Ack=27282 Win=65536 Len=0
  7.631146 131.94.134.13 -> 131.94.186.14 TCP http > 34514 [ACK] Seq=27282 Ack=606 Win=7072 Len=0
  7.634149 131.94.186.14 -> 131.94.134.13 TCP [TCP Dup ACK 295#3] 56313 > http [ACK] Seq=814 Ack=4381 Win=65536 Len=0 SLE=7301 SRE=8761
  7.634189 131.94.134.13 -> 131.94.186.14 HTTP Continuation or non-HTTP traffic
  7.634546 131.94.186.14 -> 131.94.134.13 TCP [TCP Dup ACK 295#4] 56313 > http [ACK] Seq=814 Ack=4381 Win=65536 Len=0 SLE=5841 SRE=8761
  7.634583 131.94.134.13 -> 131.94.186.14 HTTP Continuation or non-HTTP traffic
  7.635326 131.94.186.14 -> 131.94.134.13 TCP 56313 > http [ACK] Seq=814 Ack=8761 Win=65536 Len=0
  7.635350 131.94.134.13 -> 131.94.186.14 HTTP Continuation or non-HTTP traffic
  7.635507 131.94.186.14 -> 131.94.134.13 TCP 56313 > http [ACK] Seq=814 Ack=10221 Win=65536 Len=0
  7.639623 131.94.134.13 -> 131.94.186.14 HTTP Continuation or non-HTTP traffic
  7.639869 131.94.134.13 -> 131.94.186.14 HTTP Continuation or non-HTTP traffic
  7.639929 131.94.134.13 -> 131.94.186.14 HTTP Continuation or non-HTTP traffic
  7.640278 131.94.134.13 -> 131.94.186.14 HTTP Continuation or non-HTTP traffic
  7.640516 131.94.134.13 -> 131.94.186.14 HTTP Continuation or non-HTTP traffic
  7.640579 131.94.134.13 -> 131.94.186.14 HTTP Continuation or non-HTTP traffic
  7.640647 131.94.134.13 -> 131.94.186.14 HTTP Continuation or non-HTTP traffic
  7.641267 131.94.134.13 -> 131.94.186.14 HTTP Continuation or non-HTTP traffic
  7.641536 131.94.134.13 -> 131.94.186.14 HTTP Continuation or non-HTTP traffic
  7.641600 131.94.134.13 -> 131.94.186.14 HTTP Continuation or non-HTTP traffic
  7.641892 131.94.134.13 -> 131.94.186.14 HTTP Continuation or non-HTTP traffic
  7.641960 131.94.134.13 -> 131.94.186.14 HTTP Continuation or non-HTTP traffic
  7.642295 131.94.134.13 -> 131.94.186.14 HTTP Continuation or non-HTTP traffic
  7.642497 131.94.134.13 -> 131.94.186.14 HTTP Continuation or non-HTTP traffic
  7.642556 131.94.134.13 -> 131.94.186.14 HTTP Continuation or non-HTTP traffic
  7.642613 131.94.134.13 -> 131.94.186.14 HTTP Continuation or non-HTTP traffic
  7.642894 131.94.134.13 -> 131.94.186.14 HTTP Continuation or non-HTTP traffic
  7.647463 131.94.186.14 -> 131.94.134.13 TCP 56313 > http [ACK] Seq=814 Ack=13141 Win=65536 Len=0
  7.649910 131.94.186.14 -> 131.94.134.13 TCP 56313 > http [ACK] Seq=814 Ack=16061 Win=65536 Len=0
  7.657862 131.94.186.14 -> 131.94.134.13 TCP 56313 > http [ACK] Seq=814 Ack=18981 Win=65536 Len=0
  7.660847 131.94.186.14 -> 131.94.134.13 TCP 56313 > http [ACK] Seq=814 Ack=21901 Win=65536 Len=0
  7.664857 131.94.186.14 -> 131.94.134.13 TCP 56313 > http [ACK] Seq=814 Ack=23361 Win=65536 Len=0 SLE=29201 SRE=30661
  7.664874 131.94.186.14 -> 131.94.134.13 TCP [TCP Dup ACK 329#1] 56313 > http [ACK] Seq=814 Ack=23361 Win=65536 Len=0 SLE=29201 SRE=32121
  7.664983 131.94.186.14 -> 131.94.134.13 TCP [TCP Dup ACK 329#2] 56313 > http [ACK] Seq=814 Ack=23361 Win=65536 Len=0 SLE=29201 SRE=32121 SLE=33581 SRE=35041
  7.665045 131.94.186.14 -> 131.94.134.13 TCP [TCP Dup ACK 329#3] 56313 > http [ACK] Seq=814 Ack=23361 Win=65536 [TCP CHECKSUM INCORRECT] Len=0 SLE=33581 SRE=35041 SLE=39421 SRE=40881 SLE=33581 SRE=35041
  7.665058 131.94.134.13 -> 131.94.186.14 HTTP [TCP Fast Retransmission] Continuation or non-HTTP traffic
  7.665105 131.94.186.14 -> 131.94.134.13 TCP [TCP Dup ACK 329#4] 56313 > http [ACK] Seq=814 Ack=23361 Win=65536 Len=0 SLE=39421 SRE=41531 SLE=33581 SRE=35041 SLE=29201 SRE=32121
  7.671686 131.94.186.14 -> 131.94.134.13 TCP 56313 > http [ACK] Seq=814 Ack=24821 Win=65536 Len=0 SLE=39421 SRE=41531 SLE=33581 SRE=35041 SLE=29201 SRE=32121
  7.672691 131.94.186.14 -> 131.94.134.13 TCP 56313 > http [ACK] Seq=814 Ack=26281 Win=65536 Len=0 SLE=39421 SRE=41531 SLE=33581 SRE=35041 SLE=29201 SRE=32121
  7.672708 131.94.186.14 -> 131.94.134.13 TCP 56313 > http [ACK] Seq=814 Ack=27741 Win=65536 Len=0 SLE=39421 SRE=41531 SLE=33581 SRE=35041 SLE=29201 SRE=32121
  7.672859 131.94.134.13 -> 131.94.186.14 HTTP [TCP Retransmission] Continuation or non-HTTP traffic
  7.672918 131.94.186.14 -> 131.94.134.13 TCP 56313 > http [ACK] Seq=814 Ack=32121 Win=65536 Len=0 SLE=39421 SRE=41531 SLE=33581 SRE=35041
  7.672931 131.94.134.13 -> 131.94.186.14 HTTP [TCP Retransmission] Continuation or non-HTTP traffic
  7.673053 131.94.186.14 -> 131.94.134.13 TCP 56313 > http [ACK] Seq=814 Ack=35041 Win=65536 Len=0 SLE=39421 SRE=41531
  7.673065 131.94.134.13 -> 131.94.186.14 HTTP [TCP Retransmission] Continuation or non-HTTP traffic
  7.673731 131.94.186.14 -> 131.94.134.13 TCP 56313 > http [ACK] Seq=814 Ack=36501 Win=65536 Len=0 SLE=39421 SRE=41531
  7.673748 131.94.134.13 -> 131.94.186.14 HTTP [TCP Retransmission] Continuation or non-HTTP traffic
  7.673778 131.94.186.14 -> 131.94.134.13 TCP 56313 > http [ACK] Seq=814 Ack=37961 Win=65536 Len=0 SLE=39421 SRE=41531
  7.673793 131.94.186.14 -> 131.94.134.13 TCP 56313 > http [ACK] Seq=814 Ack=41532 Win=65536 Len=0
  7.673804 131.94.186.14 -> 131.94.134.13 TCP [TCP Dup ACK 346#1] 56313 > http [ACK] Seq=814 Ack=41532 Win=65536 Len=0 SLE=23361 SRE=24821
  7.678680 131.94.186.14 -> 131.94.134.13 TCP [TCP Dup ACK 346#2] 56313 > http [ACK] Seq=814 Ack=41532 Win=65536 Len=0 SLE=27741 SRE=29201
  7.680942 131.94.186.14 -> 131.94.134.13 TCP [TCP Dup ACK 346#3] 56313 > http [ACK] Seq=814 Ack=41532 Win=65536 Len=0 SLE=32121 SRE=33581
  7.681908 131.94.186.14 -> 131.94.134.13 TCP [TCP Dup ACK 346#4] 56313 > http [ACK] Seq=814 Ack=41532 Win=65536 Len=0 SLE=35041 SRE=36501
  7.681952 131.94.186.14 -> 131.94.134.13 TCP [TCP Dup ACK 346#5] 56313 > http [ACK] Seq=814 Ack=41532 Win=65536 Len=0 SLE=36501 SRE=37961
  7.686028 131.94.186.14 -> 131.94.134.13 TCP 56313 > http [FIN, ACK] Seq=814 Ack=41532 Win=65536 Len=0
  7.686060 131.94.134.13 -> 131.94.186.14 TCP http > 56313 [ACK] Seq=41532 Ack=815 Win=7488 Len=0
  7.727094 131.94.134.13 -> 131.94.186.14 HTTP HTTP/1.1 200 OK [Unreassembled Packet [incorrect TCP checksum]] 
  7.728832 131.94.186.14 -> 131.94.134.13 TCP everydayrc > http [ACK] Seq=842 Ack=2921 Win=65536 Len=0
  7.728858 131.94.134.13 -> 131.94.186.14 HTTP Continuation or non-HTTP traffic
  7.734829 131.94.186.14 -> 131.94.134.13 TCP everydayrc > http [ACK] Seq=842 Ack=5841 Win=65536 Len=0
  7.734855 131.94.134.13 -> 131.94.186.14 HTTP Continuation or non-HTTP traffic
  7.735832 131.94.186.14 -> 131.94.134.13 TCP [TCP Dup ACK 357#1] everydayrc > http [ACK] Seq=842 Ack=5841 Win=65536 Len=0 SLE=7301 SRE=8761
  7.735854 131.94.134.13 -> 131.94.186.14 HTTP Continuation or non-HTTP traffic
  7.736829 131.94.186.14 -> 131.94.134.13 TCP everydayrc > http [ACK] Seq=842 Ack=8761 Win=65536 Len=0
  7.736849 131.94.134.13 -> 131.94.186.14 HTTP Continuation or non-HTTP traffic
  7.744278 131.94.186.14 -> 131.94.134.13 TCP everydayrc > http [ACK] Seq=842 Ack=11681 Win=65536 Len=0
  7.744297 131.94.134.13 -> 131.94.186.14 HTTP Continuation or non-HTTP traffic
  7.744449 131.94.186.14 -> 131.94.134.13 TCP everydayrc > http [ACK] Seq=842 Ack=14601 Win=65536 Len=0
  7.744463 131.94.134.13 -> 131.94.186.14 HTTP Continuation or non-HTTP traffic
  7.746228 131.94.186.14 -> 131.94.134.13 TCP everydayrc > http [ACK] Seq=842 Ack=17521 Win=65536 Len=0
  7.746251 131.94.134.13 -> 131.94.186.14 HTTP Continuation or non-HTTP traffic
  7.752958 131.94.186.14 -> 131.94.134.13 TCP everydayrc > http [ACK] Seq=842 Ack=20441 Win=65536 Len=0
  7.752974 131.94.186.14 -> 131.94.134.13 TCP everydayrc > http [ACK] Seq=842 Ack=21901 Win=65536 Len=0 SLE=24821 SRE=26281
  7.752986 131.94.134.13 -> 131.94.186.14 HTTP Continuation or non-HTTP traffic
  7.753078 131.94.186.14 -> 131.94.134.13 TCP [TCP Dup ACK 370#1] everydayrc > http [ACK] Seq=842 Ack=21901 Win=65536 Len=0 SLE=24821 SRE=27741
  7.753090 131.94.186.14 -> 131.94.134.13 TCP [TCP Dup ACK 370#2] everydayrc > http [ACK] Seq=842 Ack=21901 Win=65536 Len=0 SLE=24821 SRE=29201
  7.753278 131.94.186.14 -> 131.94.134.13 TCP everydayrc > http [ACK] Seq=842 Ack=23361 Win=65536 Len=0 SLE=24821 SRE=29201
  7.753441 131.94.134.13 -> 131.94.186.14 HTTP Continuation or non-HTTP traffic
  7.755441 131.94.186.14 -> 131.94.134.13 TCP everydayrc > http [ACK] Seq=842 Ack=29201 Win=65536 Len=0
  7.761827 131.94.186.14 -> 131.94.134.13 TCP everydayrc > http [ACK] Seq=842 Ack=30661 Win=65536 Len=0
  7.761846 131.94.186.14 -> 131.94.134.13 TCP [TCP Dup ACK 377#1] everydayrc > http [ACK] Seq=842 Ack=30661 Win=65536 Len=0 SLE=32121 SRE=33581
  7.761862 131.94.134.13 -> 131.94.186.14 HTTP Continuation or non-HTTP traffic
  7.761897 131.94.186.14 -> 131.94.134.13 TCP [TCP Dup ACK 377#2] everydayrc > http [ACK] Seq=842 Ack=30661 Win=65536 Len=0 SLE=32121 SRE=35041
  7.761918 131.94.134.13 -> 131.94.186.14 HTTP Continuation or non-HTTP traffic
  7.762770 131.94.186.14 -> 131.94.134.13 TCP [TCP Dup ACK 377#3] everydayrc > http [ACK] Seq=842 Ack=30661 Win=65536 Len=0 SLE=32121 SRE=35041 SLE=37961 SRE=39421
  7.762792 131.94.134.13 -> 131.94.186.14 HTTP Continuation or non-HTTP traffic
  7.762906 131.94.186.14 -> 131.94.134.13 TCP [TCP Dup ACK 377#4] everydayrc > http [ACK] Seq=842 Ack=30661 Win=65536 Len=0 SLE=37961 SRE=40881 SLE=32121 SRE=35041
  7.762927 131.94.134.13 -> 131.94.186.14 HTTP Continuation or non-HTTP traffic
  7.762938 131.94.186.14 -> 131.94.134.13 TCP [TCP Dup ACK 377#5] everydayrc > http [ACK] Seq=842 Ack=30661 Win=65536 Len=0 SLE=37961 SRE=42341 SLE=32121 SRE=35041
  7.762957 131.94.134.13 -> 131.94.186.14 HTTP Continuation or non-HTTP traffic
  7.763140 131.94.186.14 -> 131.94.134.13 TCP [TCP Dup ACK 377#6] everydayrc > http [ACK] Seq=842 Ack=30661 Win=65536 Len=0 SLE=37961 SRE=43801 SLE=32121 SRE=35041
  7.763159 131.94.134.13 -> 131.94.186.14 HTTP Continuation or non-HTTP traffic
  7.763228 131.94.186.14 -> 131.94.134.13 TCP everydayrc > http [ACK] Seq=842 Ack=35041 Win=65536 Len=0 SLE=37961 SRE=43801
  7.763260 131.94.134.13 -> 131.94.186.14 HTTP Continuation or non-HTTP traffic
  7.763401 131.94.186.14 -> 131.94.134.13 TCP everydayrc > http [ACK] Seq=842 Ack=36501 Win=65536 Len=0 SLE=37961 SRE=43801
  7.763422 131.94.134.13 -> 131.94.186.14 HTTP Continuation or non-HTTP traffic
  7.763590 131.94.186.14 -> 131.94.134.13 TCP everydayrc > http [ACK] Seq=842 Ack=43801 Win=65536 Len=0
  7.765173 131.94.134.13 -> 131.94.186.14 HTTP Continuation or non-HTTP traffic
  7.765863 131.94.134.13 -> 131.94.186.14 HTTP Continuation or non-HTTP traffic
  7.766029 131.94.134.13 -> 131.94.186.14 HTTP Continuation or non-HTTP traffic
  7.766100 131.94.134.13 -> 131.94.186.14 HTTP Continuation or non-HTTP traffic
  7.766649 131.94.186.14 -> 131.94.134.13 TCP everydayrc > http [ACK] Seq=842 Ack=46721 Win=65536 Len=0
  7.766658 131.94.186.14 -> 131.94.134.13 TCP [TCP Dup ACK 399#1] everydayrc > http [ACK] Seq=842 Ack=46721 Win=65536 Len=0 SLE=48181 SRE=49641
  7.766662 131.94.186.14 -> 131.94.134.13 TCP [TCP Dup ACK 399#2] everydayrc > http [ACK] Seq=842 Ack=46721 Win=65536 Len=0 SLE=51101 SRE=52561 SLE=48181 SRE=49641
  7.766854 131.94.186.14 -> 131.94.134.13 TCP [TCP Dup ACK 399#3] everydayrc > http [ACK] Seq=842 Ack=46721 Win=65536 Len=0 SLE=55481 SRE=56941 SLE=51101 SRE=52561 SLE=48181 SRE=49641
  7.766868 131.94.186.14 -> 131.94.134.13 TCP [TCP Dup ACK 399#4] everydayrc > http [ACK] Seq=842 Ack=46721 Win=65536 Len=0 SLE=58401 SRE=59861 SLE=55481 SRE=56941 SLE=51101 SRE=52561 SLE=48181 SRE=49641
  7.766929 131.94.134.13 -> 131.94.186.14 HTTP Continuation or non-HTTP traffic
  7.766959 131.94.134.13 -> 131.94.186.14 HTTP Continuation or non-HTTP traffic
  7.767830 131.94.186.14 -> 131.94.134.13 TCP [TCP Dup ACK 399#5] everydayrc > http [ACK] Seq=842 Ack=46721 Win=65536 Len=0 SLE=58401 SRE=61321 SLE=55481 SRE=56941 SLE=51101 SRE=52561 SLE=48181 SRE=49641
  7.767856 131.94.134.13 -> 131.94.186.14 HTTP Continuation or non-HTTP traffic
  7.767883 131.94.134.13 -> 131.94.186.14 HTTP Continuation or non-HTTP traffic
  7.768246 131.94.186.14 -> 131.94.134.13 TCP [TCP Dup ACK 399#6] everydayrc > http [ACK] Seq=842 Ack=46721 Win=65536 Len=0 SLE=58401 SRE=62781 SLE=55481 SRE=56941 SLE=51101 SRE=52561 SLE=48181 SRE=49641
  7.768269 131.94.134.13 -> 131.94.186.14 HTTP Continuation or non-HTTP traffic
  7.768841 131.94.186.14 -> 131.94.134.13 TCP [TCP Dup ACK 399#7] everydayrc > http [ACK] Seq=842 Ack=46721 Win=65536 Len=0 SLE=58401 SRE=64241 SLE=55481 SRE=56941 SLE=51101 SRE=52561 SLE=48181 SRE=49641
  7.768860 131.94.186.14 -> 131.94.134.13 TCP everydayrc > http [ACK] Seq=842 Ack=49641 Win=65536 Len=0 SLE=58401 SRE=64241 SLE=55481 SRE=56941 SLE=51101 SRE=52561
  7.768865 131.94.186.14 -> 131.94.134.13 TCP everydayrc > http [ACK] Seq=842 Ack=52561 Win=65536 Len=0 SLE=58401 SRE=64241 SLE=55481 SRE=56941
  7.768868 131.94.186.14 -> 131.94.134.13 TCP [TCP Dup ACK 413#1] everydayrc > http [ACK] Seq=842 Ack=52561 Win=65536 Len=0 SLE=54021 SRE=56941 SLE=58401 SRE=64241
  7.768871 131.94.186.14 -> 131.94.134.13 TCP [TCP Dup ACK 413#2] everydayrc > http [ACK] Seq=842 Ack=52561 Win=65536 Len=0 SLE=54021 SRE=64241
  7.768874 131.94.186.14 -> 131.94.134.13 TCP everydayrc > http [ACK] Seq=842 Ack=64241 Win=65536 Len=0
  7.768932 131.94.134.13 -> 131.94.186.14 HTTP Continuation or non-HTTP traffic
  7.769841 131.94.134.13 -> 131.94.186.14 HTTP Continuation or non-HTTP traffic
  7.770397 131.94.134.13 -> 131.94.186.14 HTTP Continuation or non-HTTP traffic
  7.770697 131.94.134.13 -> 131.94.186.14 HTTP Continuation or non-HTTP traffic
  7.770873 131.94.134.13 -> 131.94.186.14 HTTP [TCP Out-Of-Order] Continuation or non-HTTP traffic
  7.774582 131.94.186.14 -> 131.94.134.13 TCP everydayrc > http [ACK] Seq=842 Ack=67161 Win=65536 Len=0
  7.777512 131.94.186.14 -> 131.94.134.13 TCP everydayrc > http [ACK] Seq=842 Ack=70081 Win=65536 Len=0
  7.777528 131.94.186.14 -> 131.94.134.13 TCP everydayrc > http [ACK] Seq=842 Ack=73001 Win=65536 Len=0
  7.777648 131.94.186.14 -> 131.94.134.13 TCP everydayrc > http [ACK] Seq=842 Ack=75921 Win=65536 Len=0
  7.777823 131.94.186.14 -> 131.94.134.13 TCP everydayrc > http [ACK] Seq=842 Ack=78841 Win=65536 Len=0
  7.778517 131.94.186.14 -> 131.94.134.13 TCP everydayrc > http [ACK] Seq=842 Ack=81761 Win=65536 Len=0
  7.778531 131.94.186.14 -> 131.94.134.13 TCP everydayrc > http [ACK] Seq=842 Ack=82163 Win=65280 Len=0
  7.778651 131.94.186.14 -> 131.94.134.13 TCP [TCP Dup ACK 428#1] everydayrc > http [ACK] Seq=842 Ack=82163 Win=65280 Len=0 SLE=52561 SRE=54021
  7.807817 131.94.186.14 -> 131.94.134.13 HTTP GET /wordpress/wp-admin/load-scripts.php?c=1&load%5B%5D=hoverIntent,common,admin-bar,wp-ajax-response,jquery-color,wp-lists,quicktags,jquery-query,admin-comments,jquery-ui-core,jquery-&load%5B%5D=ui-widget,jquery-ui-mouse,jquery-ui-sortable,postbox,dashboard,customize-base,customize-loader,thickbox,plugin-install,underscor&load%5B%5D=e,shortcode,media-upload,svg-painter,heartbeat,wp-auth-check,word-count,wplink&ver=4.0 HTTP/1.1 
  7.807851 131.94.134.13 -> 131.94.186.14 TCP http > 25967 [ACK] Seq=1 Ack=1134 Win=8128 Len=0
  7.809706 131.94.186.14 -> 131.94.134.13 TCP everydayrc > http [FIN, ACK] Seq=842 Ack=82163 Win=65280 Len=0
  7.809724 131.94.134.13 -> 131.94.186.14 TCP http > everydayrc [ACK] Seq=82163 Ack=843 Win=7552 Len=0
  7.861944 131.94.134.13 -> 131.94.186.14 HTTP HTTP/1.1 200 OK [Unreassembled Packet [incorrect TCP checksum]] 
  7.869404 131.94.186.14 -> 131.94.134.13 TCP 25967 > http [ACK] Seq=1134 Ack=2921 Win=65536 Len=0
  7.869428 131.94.134.13 -> 131.94.186.14 HTTP Continuation or non-HTTP traffic
  7.874193 131.94.186.14 -> 131.94.134.13 TCP 25967 > http [ACK] Seq=1134 Ack=5841 Win=65536 Len=0
  7.874212 131.94.134.13 -> 131.94.186.14 HTTP Continuation or non-HTTP traffic
  7.877911 131.94.186.14 -> 131.94.134.13 TCP 25967 > http [ACK] Seq=1134 Ack=8761 Win=65536 Len=0
  7.877929 131.94.134.13 -> 131.94.186.14 HTTP Continuation or non-HTTP traffic
  7.882874 131.94.186.14 -> 131.94.134.13 TCP 25967 > http [ACK] Seq=1134 Ack=11681 Win=65536 Len=0
  7.882891 131.94.134.13 -> 131.94.186.14 HTTP Continuation or non-HTTP traffic
  7.886910 131.94.186.14 -> 131.94.134.13 TCP 25967 > http [ACK] Seq=1134 Ack=14601 Win=65536 Len=0
  7.886929 131.94.134.13 -> 131.94.186.14 HTTP Continuation or non-HTTP traffic
  7.887006 131.94.186.14 -> 131.94.134.13 TCP 25967 > http [ACK] Seq=1134 Ack=17521 Win=65536 Len=0
  7.887019 131.94.134.13 -> 131.94.186.14 HTTP Continuation or non-HTTP traffic
  7.890308 131.94.186.14 -> 131.94.134.13 TCP 25967 > http [ACK] Seq=1134 Ack=20441 Win=65536 Len=0
  7.892928 131.94.134.13 -> 131.94.186.14 HTTP Continuation or non-HTTP traffic
  7.893267 131.94.134.13 -> 131.94.186.14 HTTP Continuation or non-HTTP traffic
  7.893577 131.94.134.13 -> 131.94.186.14 HTTP Continuation or non-HTTP traffic
  7.893635 131.94.134.13 -> 131.94.186.14 HTTP Continuation or non-HTTP traffic
  7.893692 131.94.134.13 -> 131.94.186.14 HTTP Continuation or non-HTTP traffic
  7.893722 131.94.134.13 -> 131.94.186.14 HTTP Continuation or non-HTTP traffic
  7.893742 131.94.134.13 -> 131.94.186.14 HTTP Continuation or non-HTTP traffic
  7.893762 131.94.134.13 -> 131.94.186.14 HTTP Continuation or non-HTTP traffic
  7.893864 131.94.134.13 -> 131.94.186.14 HTTP Continuation or non-HTTP traffic
  7.894039 131.94.134.13 -> 131.94.186.14 HTTP Continuation or non-HTTP traffic
  7.894101 131.94.134.13 -> 131.94.186.14 HTTP Continuation or non-HTTP traffic
  7.894158 131.94.134.13 -> 131.94.186.14 HTTP Continuation or non-HTTP traffic
  7.894214 131.94.134.13 -> 131.94.186.14 HTTP Continuation or non-HTTP traffic
  7.894270 131.94.134.13 -> 131.94.186.14 HTTP Continuation or non-HTTP traffic
  7.894327 131.94.134.13 -> 131.94.186.14 HTTP Continuation or non-HTTP traffic
  7.894384 131.94.134.13 -> 131.94.186.14 HTTP Continuation or non-HTTP traffic
  7.894440 131.94.134.13 -> 131.94.186.14 HTTP Continuation or non-HTTP traffic
  7.894496 131.94.134.13 -> 131.94.186.14 HTTP Continuation or non-HTTP traffic
  7.894552 131.94.134.13 -> 131.94.186.14 HTTP Continuation or non-HTTP traffic
  7.895814 131.94.186.14 -> 131.94.134.13 TCP 25967 > http [ACK] Seq=1134 Ack=23361 Win=65536 Len=0
  7.895830 131.94.186.14 -> 131.94.134.13 TCP 25967 > http [ACK] Seq=1134 Ack=26281 Win=65536 Len=0
  7.895836 131.94.186.14 -> 131.94.134.13 TCP 25967 > http [ACK] Seq=1134 Ack=29201 Win=65536 Len=0
  7.900814 131.94.186.14 -> 131.94.134.13 TCP 25967 > http [ACK] Seq=1134 Ack=32121 Win=65536 Len=0
  7.900873 131.94.186.14 -> 131.94.134.13 TCP 25967 > http [ACK] Seq=1134 Ack=35041 Win=65536 Len=0
  7.900883 131.94.186.14 -> 131.94.134.13 TCP 25967 > http [ACK] Seq=1134 Ack=37961 Win=65536 Len=0
  7.900888 131.94.186.14 -> 131.94.134.13 TCP 25967 > http [ACK] Seq=1134 Ack=40881 Win=65536 Len=0
  7.900934 131.94.186.14 -> 131.94.134.13 TCP 25967 > http [ACK] Seq=1134 Ack=43801 Win=65536 Len=0
  7.911348 131.94.186.14 -> 131.94.134.13 TCP 25967 > http [ACK] Seq=1134 Ack=46721 Win=65536 Len=0
  7.911364 131.94.186.14 -> 131.94.134.13 TCP 25967 > http [ACK] Seq=1134 Ack=49641 Win=65536 Len=0
  7.911369 131.94.186.14 -> 131.94.134.13 TCP 25967 > http [ACK] Seq=1134 Ack=52561 Win=65536 Len=0
  7.911374 131.94.186.14 -> 131.94.134.13 TCP 25967 > http [ACK] Seq=1134 Ack=55481 Win=65536 Len=0
  7.911579 131.94.186.14 -> 131.94.134.13 TCP 25967 > http [ACK] Seq=1134 Ack=58107 Win=65536 Len=0
  7.915038 131.94.186.14 -> 131.94.134.13 TCP 25967 > http [FIN, ACK] Seq=1134 Ack=58107 Win=65536 Len=0
  7.915242 131.94.134.13 -> 131.94.186.14 TCP http > 25967 [ACK] Seq=58107 Ack=1135 Win=8128 Len=0
  7.928045 Vmware_f1:f5:a2 -> Vmware_d8:59:bb ARP Who has 131.94.134.13?  Tell 131.94.134.1
  7.928054 Vmware_d8:59:bb -> Vmware_f1:f5:a2 ARP 131.94.134.13 is at 00:0c:29:d8:59:bb
  7.955404 131.94.186.14 -> 131.94.134.13 HTTP GET /wordpress/wp-includes/js/thickbox/loadingAnimation.gif HTTP/1.1 
  7.955624 131.94.134.13 -> 131.94.186.14 TCP http > 52526 [ACK] Seq=1 Ack=626 Win=7104 Len=0
  7.956588 131.94.134.13 -> 131.94.186.14 HTTP HTTP/1.1 200 OK  (GIF89a)
  7.956758 131.94.134.13 -> 131.94.186.14 HTTP Continuation or non-HTTP traffic
  7.956908 131.94.134.13 -> 131.94.186.14 HTTP Continuation or non-HTTP traffic
  7.956933 131.94.134.13 -> 131.94.186.14 HTTP Continuation or non-HTTP traffic
  7.956954 131.94.134.13 -> 131.94.186.14 HTTP Continuation or non-HTTP traffic
  7.956975 131.94.134.13 -> 131.94.186.14 HTTP Continuation or non-HTTP traffic
  7.956996 131.94.134.13 -> 131.94.186.14 HTTP Continuation or non-HTTP traffic
  7.957016 131.94.134.13 -> 131.94.186.14 HTTP Continuation or non-HTTP traffic
  7.957037 131.94.134.13 -> 131.94.186.14 HTTP Continuation or non-HTTP traffic
  7.957088 131.94.134.13 -> 131.94.186.14 HTTP Continuation or non-HTTP traffic
  7.967984 131.94.186.14 -> 131.94.134.13 TCP 52526 > http [ACK] Seq=626 Ack=2921 Win=65536 Len=0
  7.968005 131.94.186.14 -> 131.94.134.13 TCP 52526 > http [ACK] Seq=626 Ack=5841 Win=65536 Len=0
  7.968015 131.94.186.14 -> 131.94.134.13 TCP 52526 > http [ACK] Seq=626 Ack=8761 Win=65536 Len=0
  7.968249 131.94.186.14 -> 131.94.134.13 TCP 52526 > http [ACK] Seq=626 Ack=11681 Win=65536 Len=0
  7.968263 131.94.186.14 -> 131.94.134.13 TCP 52526 > http [ACK] Seq=626 Ack=14601 Win=65536 Len=0
  7.968272 131.94.186.14 -> 131.94.134.13 TCP 52526 > http [ACK] Seq=626 Ack=15496 Win=64768 Len=0
  7.968327 131.94.186.14 -> 131.94.134.13 TCP 52526 > http [FIN, ACK] Seq=626 Ack=15496 Win=64768 Len=0
  7.968340 131.94.134.13 -> 131.94.186.14 TCP http > 52526 [ACK] Seq=15496 Ack=627 Win=7104 Len=0
  8.207102 Vmware_d6:f3:a1 -> Broadcast    ARP Who has 131.194.134.1?  Tell 131.194.134.16
  9.269148 Vmware_d6:f3:a1 -> Broadcast    ARP Who has 131.194.134.1?  Tell 131.194.134.16
 10.337198 Vmware_d6:f3:a1 -> Broadcast    ARP Who has 131.194.134.1?  Tell 131.194.134.16
 10.731033 131.94.132.160 -> 131.94.134.13 SSHv2 Encrypted request packet len=296
 10.731106 131.94.134.13 -> 131.94.132.160 TCP ssh > 49477 [ACK] Seq=2157 Ack=1817 Win=11232 Len=0
 10.736368 131.94.134.13 -> 131.94.134.129 DNS Standard query A instructor134.aul.fiu.edu
 10.739372 131.94.134.129 -> 131.94.134.13 DNS Standard query response A 131.94.132.160
 10.747366 131.94.134.13 -> 131.94.134.129 DNS Standard query A instructor134.aul.fiu.edu
 10.749422 131.94.134.129 -> 131.94.134.13 DNS Standard query response A 131.94.132.160
 10.750412 131.94.134.13 -> 131.94.132.160 SSHv2 Encrypted response packet len=36
 10.756753 131.94.132.160 -> 131.94.134.13 SSHv2 Encrypted request packet len=68
 10.797381 131.94.134.13 -> 131.94.132.160 TCP ssh > 49477 [ACK] Seq=2193 Ack=1885 Win=11232 Len=0
 10.904538 131.94.134.13 -> 131.94.134.129 DNS Standard query A instructor134.aul.fiu.edu
 10.906350 131.94.134.129 -> 131.94.134.13 DNS Standard query response A 131.94.132.160
 10.912566 131.94.134.13 -> 131.94.134.129 DNS Standard query A instructor134.aul.fiu.edu
 10.914364 131.94.134.129 -> 131.94.134.13 DNS Standard query response A 131.94.132.160
 10.930432 131.94.134.13 -> 131.94.134.129 DNS Standard query A instructor134.aul.fiu.edu
 10.931357 131.94.134.129 -> 131.94.134.13 DNS Standard query response A 131.94.132.160
 10.936780 131.94.134.13 -> 131.94.132.160 SSHv2 Encrypted response packet len=52
 10.938863 131.94.132.160 -> 131.94.134.13 SSHv2 Encrypted request packet len=100
 10.938883 131.94.134.13 -> 131.94.132.160 TCP ssh > 49477 [ACK] Seq=2245 Ack=1985 Win=11232 Len=0
 10.938924 131.94.132.160 -> 131.94.134.13 SSHv2 Encrypted request packet len=52
 10.938934 131.94.134.13 -> 131.94.132.160 TCP ssh > 49477 [ACK] Seq=2245 Ack=2037 Win=11232 Len=0
 10.990266 131.94.134.13 -> 131.94.134.129 DNS Standard query A instructor134.aul.fiu.edu
 10.991334 131.94.134.129 -> 131.94.134.13 DNS Standard query response A 131.94.132.160
 11.006327 131.94.134.13 -> 131.94.132.160 SSHv2 Encrypted response packet len=124
 11.006327 131.94.134.13 -> 131.94.132.160 SSHv2 Encrypted response packet len=132
 11.010275 131.94.132.160 -> 131.94.134.13 TCP 49477 > ssh [ACK] Seq=2037 Ack=2501 Win=65024 Len=0
 11.138207 131.94.186.14 -> 131.94.134.13 TCP hp-status > http [SYN] Seq=0 Win=8192 Len=0 MSS=1460 WS=8
 11.138433 131.94.134.13 -> 131.94.186.14 TCP http > hp-status [SYN, ACK] Seq=0 Ack=1 Win=5840 Len=0 MSS=1460 WS=5
 11.143587 131.94.186.14 -> 131.94.134.13 TCP hp-status > http [ACK] Seq=1 Ack=1 Win=65536 Len=0
 11.145564 131.94.186.14 -> 131.94.134.13 HTTP GET /wordpress/wp-admin/edit.php?post_type=post HTTP/1.1 
 11.145626 131.94.134.13 -> 131.94.186.14 TCP http > hp-status [ACK] Seq=1 Ack=819 Win=7488 Len=0
 12.280659 131.94.134.13 -> 131.94.186.14 HTTP HTTP/1.1 200 OK [Unreassembled Packet [incorrect TCP checksum]] 
 12.292888 131.94.186.14 -> 131.94.134.13 TCP hp-status > http [ACK] Seq=819 Ack=2921 Win=65536 Len=0
 12.292930 131.94.134.13 -> 131.94.186.14 HTTP Continuation or non-HTTP traffic
 12.299425 131.94.186.14 -> 131.94.134.13 TCP hp-status > http [ACK] Seq=819 Ack=5841 Win=65536 Len=0
 12.299463 131.94.134.13 -> 131.94.186.14 HTTP Continuation or non-HTTP traffic
 12.299720 131.94.186.14 -> 131.94.134.13 TCP hp-status > http [ACK] Seq=819 Ack=8761 Win=65536 Len=0
 12.305129 131.94.134.13 -> 131.94.186.14 HTTP Continuation or non-HTTP traffic
 12.314959 131.94.186.14 -> 131.94.134.13 TCP hp-status > http [ACK] Seq=819 Ack=10506 Win=65536 Len=0
 12.314984 131.94.134.13 -> 131.94.186.14 HTTP Continuation or non-HTTP traffic
 12.315049 131.94.134.13 -> 131.94.186.14 HTTP Continuation or non-HTTP traffic
 12.315151 131.94.186.14 -> 131.94.134.13 TCP hp-status > http [ACK] Seq=819 Ack=13426 Win=65536 Len=0
 12.321127 131.94.134.13 -> 131.94.186.14 HTTP Continuation or non-HTTP traffic
 12.334161 131.94.186.14 -> 131.94.134.13 TCP hp-status > http [ACK] Seq=819 Ack=16346 Win=65536 Len=0
 12.334184 131.94.134.13 -> 131.94.186.14 HTTP Continuation or non-HTTP traffic
 12.334421 131.94.134.13 -> 131.94.186.14 HTTP Continuation or non-HTTP traffic
 12.338308 131.94.186.14 -> 131.94.134.13 TCP hp-status > http [ACK] Seq=819 Ack=18774 Win=65536 Len=0
 12.338324 131.94.186.14 -> 131.94.134.13 TCP hp-status > http [ACK] Seq=819 Ack=21694 Win=65536 Len=0
 12.338329 131.94.186.14 -> 131.94.134.13 TCP hp-status > http [ACK] Seq=819 Ack=24614 Win=65536 Len=0
 12.338334 131.94.186.14 -> 131.94.134.13 TCP hp-status > http [ACK] Seq=819 Ack=26208 Win=65536 Len=0
 12.399452 131.94.134.13 -> 131.94.186.14 HTTP Continuation or non-HTTP traffic
 12.399601 131.94.134.13 -> 131.94.186.14 HTTP Continuation or non-HTTP traffic
 12.421587 131.94.186.14 -> 131.94.134.13 TCP hp-status > http [ACK] Seq=819 Ack=29128 Win=65536 Len=0
 12.421615 131.94.186.14 -> 131.94.134.13 TCP hp-status > http [ACK] Seq=819 Ack=32048 Win=65536 Len=0
 12.421623 131.94.186.14 -> 131.94.134.13 TCP hp-status > http [ACK] Seq=819 Ack=34968 Win=65536 Len=0
 12.423111 131.94.134.13 -> 131.94.186.14 HTTP Continuation or non-HTTP traffic
 12.423111 131.94.134.13 -> 131.94.186.14 HTTP Continuation or non-HTTP traffic
 12.430199 131.94.186.14 -> 131.94.134.13 TCP hp-status > http [ACK] Seq=819 Ack=36854 Win=65536 Len=0
 12.431215 131.94.186.14 -> 131.94.134.13 TCP hp-status > http [ACK] Seq=819 Ack=39774 Win=65536 Len=0
 12.431231 131.94.186.14 -> 131.94.134.13 TCP hp-status > http [ACK] Seq=819 Ack=42694 Win=65536 Len=0
 12.432284 131.94.186.14 -> 131.94.134.13 TCP hp-status > http [ACK] Seq=819 Ack=43686 Win=64512 Len=0
 12.544093 131.94.134.13 -> 131.94.186.14 HTTP Continuation or non-HTTP traffic
 12.545093 131.94.134.13 -> 131.94.186.14 TCP http > hp-status [FIN, ACK] Seq=43691 Ack=819 Win=7488 Len=0
 12.556365 131.94.186.14 -> 131.94.134.13 TCP hp-status > http [ACK] Seq=819 Ack=43692 Win=64512 Len=0
 12.619882 131.94.186.14 -> 131.94.134.13 TCP hp-status > http [FIN, ACK] Seq=819 Ack=43692 Win=64512 Len=0
 12.619902 131.94.134.13 -> 131.94.186.14 TCP http > hp-status [ACK] Seq=43692 Ack=820 Win=7488 Len=0
 12.631336 131.94.186.14 -> 131.94.134.13 TCP policyserver > http [SYN] Seq=0 Win=8192 Len=0 MSS=1460 WS=8
 12.631365 131.94.134.13 -> 131.94.186.14 TCP http > policyserver [SYN, ACK] Seq=0 Ack=1 Win=5840 Len=0 MSS=1460 WS=5
 12.631374 131.94.186.14 -> 131.94.134.13 TCP nimaux > http [SYN] Seq=0 Win=8192 Len=0 MSS=1460 WS=8
 12.631387 131.94.134.13 -> 131.94.186.14 TCP http > nimaux [SYN, ACK] Seq=0 Ack=1 Win=5840 Len=0 MSS=1460 WS=5
 12.631394 131.94.186.14 -> 131.94.134.13 TCP 54534 > http [SYN] Seq=0 Win=8192 Len=0 MSS=1460 WS=8
 12.631407 131.94.134.13 -> 131.94.186.14 TCP http > 54534 [SYN, ACK] Seq=0 Ack=1 Win=5840 Len=0 MSS=1460 WS=5
 12.638085 131.94.186.14 -> 131.94.134.13 TCP policyserver > http [ACK] Seq=1 Ack=1 Win=65536 Len=0
 12.640903 131.94.186.14 -> 131.94.134.13 TCP nimaux > http [ACK] Seq=1 Ack=1 Win=65536 Len=0
 12.640916 131.94.186.14 -> 131.94.134.13 TCP 54534 > http [ACK] Seq=1 Ack=1 Win=65536 Len=0
 12.640920 131.94.186.14 -> 131.94.134.13 HTTP GET /wordpress/wp-admin/load-scripts.php?c=1&load%5B%5D=jquery-core,jquery-migrate,utils&ver=4.0 HTTP/1.1 
 12.641099 131.94.134.13 -> 131.94.186.14 TCP http > policyserver [ACK] Seq=1 Ack=831 Win=7520 Len=0
 12.709068 131.94.134.13 -> 131.94.186.14 HTTP HTTP/1.1 200 OK [Unreassembled Packet [incorrect TCP checksum]] 
 12.730118 131.94.186.14 -> 131.94.134.13 TCP policyserver > http [ACK] Seq=831 Ack=2921 Win=65536 Len=0
 12.730139 131.94.134.13 -> 131.94.186.14 HTTP Continuation or non-HTTP traffic
 12.746107 131.94.186.14 -> 131.94.134.13 TCP policyserver > http [ACK] Seq=831 Ack=5841 Win=65536 Len=0
 12.746127 131.94.134.13 -> 131.94.186.14 HTTP Continuation or non-HTTP traffic
 12.746144 131.94.186.14 -> 131.94.134.13 TCP policyserver > http [ACK] Seq=831 Ack=8761 Win=65536 Len=0
 12.746158 131.94.134.13 -> 131.94.186.14 HTTP Continuation or non-HTTP traffic
 12.793165 131.94.186.14 -> 131.94.134.13 TCP policyserver > http [ACK] Seq=831 Ack=11681 Win=65536 Len=0
 12.793204 131.94.134.13 -> 131.94.186.14 HTTP Continuation or non-HTTP traffic
 12.793277 131.94.186.14 -> 131.94.134.13 TCP policyserver > http [ACK] Seq=831 Ack=14601 Win=65536 Len=0
 12.793312 131.94.134.13 -> 131.94.186.14 HTTP Continuation or non-HTTP traffic
 12.793373 131.94.186.14 -> 131.94.134.13 TCP policyserver > http [ACK] Seq=831 Ack=17521 Win=65536 Len=0
 12.793406 131.94.134.13 -> 131.94.186.14 HTTP Continuation or non-HTTP traffic
 12.811060 131.94.186.14 -> 131.94.134.13 TCP policyserver > http [ACK] Seq=831 Ack=20441 Win=65536 Len=0
 12.811097 131.94.186.14 -> 131.94.134.13 TCP policyserver > http [ACK] Seq=831 Ack=23361 Win=65536 Len=0
 12.811116 131.94.134.13 -> 131.94.186.14 HTTP Continuation or non-HTTP traffic
 12.812059 131.94.186.14 -> 131.94.134.13 TCP policyserver > http [ACK] Seq=831 Ack=26281 Win=65536 Len=0
 12.812078 131.94.134.13 -> 131.94.186.14 HTTP Continuation or non-HTTP traffic
 12.812089 131.94.134.13 -> 131.94.186.14 HTTP Continuation or non-HTTP traffic
 12.812101 131.94.186.14 -> 131.94.134.13 TCP policyserver > http [ACK] Seq=831 Ack=29201 Win=65536 Len=0
 12.815052 131.94.134.13 -> 131.94.186.14 HTTP Continuation or non-HTTP traffic
 12.815052 131.94.134.13 -> 131.94.186.14 TCP http > policyserver [FIN, ACK] Seq=40412 Ack=831 Win=7520 Len=0
 12.852635 131.94.186.14 -> 131.94.134.13 TCP policyserver > http [ACK] Seq=831 Ack=32121 Win=65536 Len=0
 12.852674 131.94.186.14 -> 131.94.134.13 TCP policyserver > http [ACK] Seq=831 Ack=35041 Win=65536 Len=0
 12.852681 131.94.186.14 -> 131.94.134.13 TCP policyserver > http [ACK] Seq=831 Ack=37961 Win=65536 Len=0
 12.854604 131.94.186.14 -> 131.94.134.13 TCP policyserver > http [ACK] Seq=831 Ack=40407 Win=65536 Len=0
 12.854801 131.94.186.14 -> 131.94.134.13 TCP policyserver > http [ACK] Seq=831 Ack=40413 Win=65536 Len=0
 12.910811 131.94.186.14 -> 131.94.134.13 TCP policyserver > http [FIN, ACK] Seq=831 Ack=40413 Win=65536 Len=0
 12.910843 131.94.134.13 -> 131.94.186.14 TCP http > policyserver [ACK] Seq=40413 Ack=832 Win=7520 Len=0
 12.910969 131.94.186.14 -> 131.94.134.13 HTTP GET /wordpress/wp-admin/load-scripts.php?c=1&load%5B%5D=hoverIntent,common,admin-bar,suggest,heartbeat,inline-edit-post,svg-painter,wp-auth-check&ver=4.0 HTTP/1.1 
 12.911170 131.94.134.13 -> 131.94.186.14 TCP http > nimaux [ACK] Seq=1 Ack=888 Win=7616 Len=0
 13.068441 131.94.134.13 -> 131.94.186.14 HTTP HTTP/1.1 200 OK [Unreassembled Packet [incorrect TCP checksum]] 
 13.075444 131.94.134.13 -> 131.94.186.14 HTTP Continuation or non-HTTP traffic
 13.075613 131.94.134.13 -> 131.94.186.14 HTTP Continuation or non-HTTP traffic
 13.076144 131.94.134.13 -> 131.94.186.14 HTTP Continuation or non-HTTP traffic
 13.076402 131.94.134.13 -> 131.94.186.14 HTTP Continuation or non-HTTP traffic
 13.076461 131.94.134.13 -> 131.94.186.14 HTTP Continuation or non-HTTP traffic
 13.076686 131.94.134.13 -> 131.94.186.14 HTTP Continuation or non-HTTP traffic
 13.076747 131.94.134.13 -> 131.94.186.14 HTTP Continuation or non-HTTP traffic
 13.081142 131.94.186.14 -> 131.94.134.13 TCP nimaux > http [ACK] Seq=888 Ack=2921 Win=65536 Len=0
 13.085178 131.94.186.14 -> 131.94.134.13 TCP nimaux > http [ACK] Seq=888 Ack=5841 Win=65536 Len=0
 13.088096 131.94.186.14 -> 131.94.134.13 TCP nimaux > http [ACK] Seq=888 Ack=8761 Win=65536 Len=0
 13.088114 131.94.186.14 -> 131.94.134.13 TCP nimaux > http [ACK] Seq=888 Ack=11681 Win=65536 Len=0
 13.088120 131.94.186.14 -> 131.94.134.13 TCP nimaux > http [ACK] Seq=888 Ack=14589 Win=65536 Len=0
 13.089241 131.94.186.14 -> 131.94.134.13 TCP nimaux > http [FIN, ACK] Seq=888 Ack=14589 Win=65536 Len=0
 13.089259 131.94.134.13 -> 131.94.186.14 TCP http > nimaux [ACK] Seq=14589 Ack=889 Win=7616 Len=0
 13.093138 Vmware_f1:f5:a2 -> Broadcast    ARP Who has 131.94.134.22?  Tell 131.94.134.1
 13.210992 131.94.134.13 -> 131.94.132.160 SSHv2 Encrypted response packet len=132
 13.245344 131.94.132.160 -> 131.94.134.13 TCP 49477 > ssh [ACK] Seq=2037 Ack=2633 Win=64768 Len=0
 13.329014 Vmware_f1:f5:a2 -> Broadcast    ARP Who has 131.94.134.22?  Tell 131.94.134.1
 13.562444 Vmware_f1:f5:a2 -> Broadcast    ARP Who has 131.94.134.22?  Tell 131.94.134.1
 13.664972 131.94.132.160 -> 131.94.134.13 SSHv2 Encrypted request packet len=52
 13.665043 131.94.134.13 -> 131.94.132.160 TCP ssh > 49477 [ACK] Seq=2633 Ack=2089 Win=11232 Len=0
 13.666922 131.94.134.13 -> 131.94.132.160 SSHv2 Encrypted response packet len=52
 13.715984 131.94.132.160 -> 131.94.134.13 SSHv2 Encrypted request packet len=52
 13.716915 131.94.134.13 -> 131.94.132.160 SSHv2 Encrypted response packet len=52
 13.743299 131.94.132.160 -> 131.94.134.13 TCP 49477 > ssh [ACK] Seq=2141 Ack=2737 Win=64768 Len=0
 13.823908 131.94.132.160 -> 131.94.134.13 SSHv2 Encrypted request packet len=52
 13.823899 131.94.134.13 -> 131.94.132.160 SSHv2 Encrypted response packet len=52
 13.839932 131.94.132.160 -> 131.94.134.13 SSHv2 Encrypted request packet len=52
 13.839896 131.94.134.13 -> 131.94.132.160 SSHv2 Encrypted response packet len=52
 13.907532 131.94.132.160 -> 131.94.134.13 SSHv2 Encrypted request packet len=52
 13.908886 131.94.134.13 -> 131.94.132.160 SSHv2 Encrypted response packet len=52
 13.970924 131.94.132.160 -> 131.94.134.13 SSHv2 Encrypted request packet len=52
 13.971876 131.94.134.13 -> 131.94.132.160 SSHv2 Encrypted response packet len=52
 13.990182 131.94.132.160 -> 131.94.134.13 SSHv2 Encrypted request packet len=52
 13.990873 131.94.134.13 -> 131.94.132.160 SSHv2 Encrypted response packet len=52
 14.028742 131.94.132.160 -> 131.94.134.13 SSHv2 Encrypted request packet len=52
 14.029867 131.94.134.13 -> 131.94.132.160 SSHv2 Encrypted response packet len=52
 14.102940 131.94.132.160 -> 131.94.134.13 TCP 49477 > ssh [ACK] Seq=2453 Ack=3049 Win=64256 Len=0
 14.293673 131.94.186.14 -> 131.94.134.13 TCP 54534 > http [FIN, ACK] Seq=1 Ack=1 Win=65536 Len=0
 14.294664 131.94.134.13 -> 131.94.186.14 TCP http > 54534 [ACK] Seq=1 Ack=2 Win=5856 Len=0
 14.293827 131.94.134.13 -> 131.94.186.14 TCP http > 54534 [FIN, ACK] Seq=1 Ack=2 Win=5856 Len=0
 14.296166 131.94.186.14 -> 131.94.134.13 TCP 54534 > http [ACK] Seq=2 Ack=2 Win=65536 Len=0
 14.425807 131.94.134.13 -> 131.94.132.160 SSHv2 Encrypted response packet len=68
 14.497434 131.94.132.160 -> 131.94.134.13 TCP 49477 > ssh [ACK] Seq=2453 Ack=3117 Win=64256 Len=0
 14.754865 131.94.132.160 -> 131.94.134.13 SSHv2 Encrypted request packet len=52
 14.754757 131.94.134.13 -> 131.94.132.160 SSHv2 Encrypted response packet len=52
 14.832201 131.94.132.160 -> 131.94.134.13 TCP 49477 > ssh [ACK] Seq=2505 Ack=3169 Win=64256 Len=0
 14.832234 131.94.132.160 -> 131.94.134.13 SSHv2 Encrypted request packet len=52
 14.831745 131.94.134.13 -> 131.94.132.160 SSHv2 Encrypted response packet len=52
 14.861939 131.94.132.160 -> 131.94.134.13 SSHv2 Encrypted request packet len=52
 14.861741 131.94.134.13 -> 131.94.132.160 SSHv2 Encrypted response packet len=52
 14.930384 131.94.132.160 -> 131.94.134.13 TCP 49477 > ssh [ACK] Seq=2609 Ack=3273 Win=64256 Len=0
 14.931359 131.94.132.160 -> 131.94.134.13 SSHv2 Encrypted request packet len=52
 14.931730 131.94.134.13 -> 131.94.132.160 SSHv2 Encrypted response packet len=52
 14.966827 131.94.132.160 -> 131.94.134.13 SSHv2 Encrypted request packet len=52
 14.966725 131.94.134.13 -> 131.94.132.160 SSHv2 Encrypted response packet len=52
 15.024748 131.94.132.160 -> 131.94.134.13 SSHv2 Encrypted request packet len=52
 15.024716 131.94.134.13 -> 131.94.132.160 SSHv2 Encrypted response packet len=52
 15.032807 131.94.132.160 -> 131.94.134.13 SSHv2 Encrypted request packet len=52
 15.032715 131.94.134.13 -> 131.94.132.160 SSHv2 Encrypted response packet len=52
 15.035535 Vmware_d6:f3:a1 -> Broadcast    ARP Who has 131.194.134.1?  Tell 131.194.134.16
 15.111731 131.94.132.160 -> 131.94.134.13 TCP 49477 > ssh [ACK] Seq=2817 Ack=3481 Win=65536 Len=0
 15.111787 131.94.132.160 -> 131.94.134.13 SSHv2 Encrypted request packet len=52
 15.111703 131.94.134.13 -> 131.94.132.160 SSHv2 Encrypted response packet len=52
 15.121764 131.94.132.160 -> 131.94.134.13 SSHv2 Encrypted request packet len=52
 15.121701 131.94.134.13 -> 131.94.132.160 SSHv2 Encrypted response packet len=52
 15.179859 131.94.132.160 -> 131.94.134.13 SSHv2 Encrypted request packet len=52
 15.180692 131.94.134.13 -> 131.94.132.160 SSHv2 Encrypted response packet len=52
 15.289685 131.94.132.160 -> 131.94.134.13 TCP 49477 > ssh [ACK] Seq=2973 Ack=3637 Win=65280 Len=0
 16.083555 131.94.134.13 -> 131.94.132.160 SSHv2 Encrypted response packet len=84
 16.115550 131.94.134.13 -> 131.94.132.160 SSHv2 Encrypted response packet len=68
 16.118569 131.94.132.160 -> 131.94.134.13 TCP 49477 > ssh [ACK] Seq=2973 Ack=3789 Win=65024 Len=0
 16.350363 Vmware_d6:f3:a1 -> Broadcast    ARP Who has 131.194.134.1?  Tell 131.194.134.16
 17.347483 Vmware_d6:f3:a1 -> Broadcast    ARP Who has 131.194.134.1?  Tell 131.194.134.16
 18.462193 131.94.132.160 -> 131.94.134.13 SSHv2 Encrypted request packet len=68
 18.464193 131.94.134.13 -> 131.94.132.160 SSHv2 Encrypted response packet len=84
 18.521184 131.94.132.160 -> 131.94.134.13 TCP 49477 > ssh [ACK] Seq=3041 Ack=3873 Win=65024 Len=0
 18.600172 Vmware_f1:f5:a2 -> Broadcast    ARP Who has 131.94.134.4?  Tell 131.94.134.1
 19.135091 131.94.132.160 -> 131.94.134.13 SSHv2 Encrypted request packet len=52
 19.136091 131.94.134.13 -> 131.94.132.160 SSHv2 Encrypted response packet len=52
 19.144090 Vmware_f1:f5:a2 -> Broadcast    ARP Who has 131.94.134.21?  Tell 131.94.134.1
 19.152089 131.94.132.160 -> 131.94.134.13 SSHv2 Encrypted request packet len=52
 19.152089 131.94.134.13 -> 131.94.132.160 SSHv2 Encrypted response packet len=52
 19.160087 131.94.132.160 -> 131.94.134.13 SSHv2 Encrypted request packet len=52
 19.161087 131.94.134.13 -> 131.94.132.160 SSHv2 Encrypted response packet len=52
 19.199081 131.94.132.160 -> 131.94.134.13 SSHv2 Encrypted request packet len=52
 19.200081 131.94.134.13 -> 131.94.132.160 SSHv2 Encrypted response packet len=52
 19.253073 131.94.132.160 -> 131.94.134.13 SSHv2 Encrypted request packet len=52
 19.254073 131.94.134.13 -> 131.94.132.160 SSHv2 Encrypted response packet len=52
 19.287068 131.94.132.160 -> 131.94.134.13 SSHv2 Encrypted request packet len=52
 19.289068 131.94.134.13 -> 131.94.132.160 SSHv2 Encrypted response packet len=52
 19.305065 131.94.132.160 -> 131.94.134.13 SSHv2 Encrypted request packet len=52
 19.306065 131.94.134.13 -> 131.94.132.160 SSHv2 Encrypted response packet len=52
 19.327062 131.94.132.160 -> 131.94.134.13 SSHv2 Encrypted request packet len=52
 19.328062 131.94.134.13 -> 131.94.132.160 SSHv2 Encrypted response packet len=52
 19.378054 131.94.134.13 -> 131.94.132.160 SSHv2 Encrypted response packet len=68
 19.379054 131.94.134.13 -> 131.94.132.160 SSHv2 Encrypted response packet len=100
 19.382054 131.94.132.160 -> 131.94.134.13 TCP 49477 > ssh [ACK] Seq=3457 Ack=4357 Win=64512 Len=0
 19.382054 131.94.134.13 -> 131.94.132.160 SSHv2 Encrypted response packet len=932
 19.385053 131.94.132.160 -> 131.94.134.13 TCP 49477 > ssh [ACK] Seq=3457 Ack=5389 Win=65536 Len=0
 19.386053 131.94.134.13 -> 131.94.132.160 SSHv2 Encrypted response packet len=84
 19.386053 131.94.134.13 -> 131.94.132.160 SSHv2 Encrypted response packet len=68
 19.388053 131.94.132.160 -> 131.94.134.13 TCP 49477 > ssh [ACK] Seq=3457 Ack=5541 Win=65536 Len=0
 19.817987 131.94.132.160 -> 131.94.134.13 SSHv2 Encrypted request packet len=52
 19.817987 131.94.134.13 -> 131.94.132.160 SSHv2 Encrypted response packet len=52
 19.830985 131.94.132.160 -> 131.94.134.13 SSHv2 Encrypted request packet len=52
 19.830985 131.94.134.13 -> 131.94.132.160 SSHv2 Encrypted response packet len=52
 19.846983 131.94.132.160 -> 131.94.134.13 SSHv2 Encrypted request packet len=52
 19.847983 131.94.134.13 -> 131.94.132.160 SSHv2 Encrypted response packet len=52
 19.897975 131.94.132.160 -> 131.94.134.13 SSHv2 Encrypted request packet len=52
 19.898975 131.94.134.13 -> 131.94.132.160 SSHv2 Encrypted response packet len=52
 19.982962 131.94.132.160 -> 131.94.134.13 SSHv2 Encrypted request packet len=52
 19.983962 131.94.134.13 -> 131.94.132.160 SSHv2 Encrypted response packet len=52
 19.983962 131.94.134.13 -> 131.94.132.160 SSHv2 Encrypted response packet len=68
 19.983962 131.94.134.13 -> 131.94.132.160 SSHv2 Encrypted response packet len=68
 19.985962 131.94.132.160 -> 131.94.134.13 TCP 49477 > ssh [ACK] Seq=3717 Ack=5869 Win=65024 Len=0
 20.056951 131.94.132.160 -> 131.94.134.13 SSHv2 Encrypted request packet len=52
 20.056951 131.94.134.13 -> 131.94.132.160 SSHv2 Encrypted response packet len=52
 20.057951 131.94.132.160 -> 131.94.134.13 SSHv2 Encrypted request packet len=52
 20.057951 131.94.134.13 -> 131.94.132.160 SSHv2 Encrypted response packet len=52
 20.059950 131.94.132.160 -> 131.94.134.13 TCP 49477 > ssh [ACK] Seq=3821 Ack=6041 Win=65024 Len=0
 20.060950 131.94.132.160 -> 131.94.134.13 SSHv2 Encrypted request packet len=52
 20.060950 131.94.134.13 -> 131.94.132.160 SSHv2 Encrypted response packet len=52
 20.072949 131.94.132.160 -> 131.94.134.13 SSHv2 Encrypted request packet len=52
 20.072949 131.94.134.13 -> 131.94.132.160 SSHv2 Encrypted response packet len=52
 20.101944 131.94.132.160 -> 131.94.134.13 SSHv2 Encrypted request packet len=52
 20.101944 131.94.134.13 -> 131.94.132.160 SSHv2 Encrypted response packet len=52
 20.139938 131.94.132.160 -> 131.94.134.13 SSHv2 Encrypted request packet len=52
 20.140938 131.94.134.13 -> 131.94.132.160 SSHv2 Encrypted response packet len=52
 20.151937 131.94.132.160 -> 131.94.134.13 SSHv2 Encrypted request packet len=52
 20.151937 131.94.134.13 -> 131.94.132.160 SSHv2 Encrypted response packet len=52
 20.176933 131.94.132.160 -> 131.94.134.13 SSHv2 Encrypted request packet len=52
 20.177933 131.94.134.13 -> 131.94.132.160 SSHv2 Encrypted response packet len=52
 20.206928 131.94.134.13 -> 131.94.132.160 SSHv2 Encrypted response packet len=68
 20.208928 131.94.134.13 -> 131.94.132.160 SSHv2 Encrypted response packet len=164
 20.208928 131.94.134.13 -> 131.94.132.160 SSHv2 Encrypted response packet len=180
 20.211927 131.94.132.160 -> 131.94.134.13 TCP 49477 > ssh [ACK] Seq=4133 Ack=6421 Win=64512 Len=0
 20.211927 131.94.134.13 -> 131.94.132.160 SSHv2 Encrypted response packet len=1460
 20.211927 131.94.134.13 -> 131.94.132.160 SSHv2 Encrypted response packet len=456
 20.213927 131.94.132.160 -> 131.94.134.13 TCP 49477 > ssh [ACK] Seq=4133 Ack=6765 Win=64256 Len=0
 20.215927 131.94.132.160 -> 131.94.134.13 TCP 49477 > ssh [ACK] Seq=4133 Ack=8681 Win=65536 Len=0
 20.216927 131.94.134.13 -> 131.94.132.160 SSHv2 Encrypted response packet len=68
 20.217926 131.94.134.13 -> 131.94.132.160 SSHv2 Encrypted response packet len=68
 20.219926 131.94.132.160 -> 131.94.134.13 TCP 49477 > ssh [ACK] Seq=4133 Ack=8817 Win=65536 Len=0
 20.445892 Vmware_d6:f3:a1 -> Broadcast    ARP Who has 131.194.134.1?  Tell 131.194.134.16
 21.191778 Vmware_f1:f5:a2 -> Vmware_d8:59:bb ARP Who has 131.94.134.13?  Tell 131.94.134.1
 21.191778 Vmware_d8:59:bb -> Vmware_f1:f5:a2 ARP 131.94.134.13 is at 00:0c:29:d8:59:bb
 21.512730 Vmware_d6:f3:a1 -> Broadcast    ARP Who has 131.194.134.1?  Tell 131.194.134.16
 22.566569 Vmware_d6:f3:a1 -> Broadcast    ARP Who has 131.194.134.1?  Tell 131.194.134.16
 24.584263 131.94.132.160 -> 131.94.134.13 SSHv2 Encrypted request packet len=52
 24.585263 131.94.134.13 -> 131.94.132.160 SSHv2 Encrypted response packet len=52
 24.605260 131.94.132.160 -> 131.94.134.13 SSHv2 Encrypted request packet len=52
 24.605260 131.94.134.13 -> 131.94.132.160 SSHv2 Encrypted response packet len=52
 24.642254 131.94.132.160 -> 131.94.134.13 TCP 49477 > ssh [ACK] Seq=4237 Ack=8921 Win=65280 Len=0
 24.853222 131.94.132.160 -> 131.94.134.13 SSHv2 Encrypted request packet len=52
 24.854222 131.94.134.13 -> 131.94.132.160 SSHv2 Encrypted response packet len=52
 24.867220 131.94.132.160 -> 131.94.134.13 SSHv2 Encrypted request packet len=52
 24.867220 131.94.134.13 -> 131.94.132.160 SSHv2 Encrypted response packet len=52
 24.869219 131.94.132.160 -> 131.94.134.13 SSHv2 Encrypted request packet len=52
 24.870219 131.94.134.13 -> 131.94.132.160 SSHv2 Encrypted response packet len=52
 24.930210 131.94.132.160 -> 131.94.134.13 SSHv2 Encrypted request packet len=52
 24.930210 131.94.134.13 -> 131.94.132.160 SSHv2 Encrypted response packet len=52
 24.998200 131.94.132.160 -> 131.94.134.13 TCP 49477 > ssh [ACK] Seq=4445 Ack=9129 Win=65024 Len=0
 24.998200 131.94.132.160 -> 131.94.134.13 SSHv2 Encrypted request packet len=52
 25.000199 131.94.134.13 -> 131.94.132.160 SSHv2 Encrypted response packet len=52
 25.025196 131.94.186.14 -> 131.94.134.13 TCP 65013 > http [SYN] Seq=0 Win=8192 Len=0 MSS=1460 WS=8
 25.025196 131.94.134.13 -> 131.94.186.14 TCP http > 65013 [SYN, ACK] Seq=0 Ack=1 Win=5840 Len=0 MSS=1460 WS=5
 25.034194 131.94.186.14 -> 131.94.134.13 TCP 65013 > http [ACK] Seq=1 Ack=1 Win=65536 Len=0
 25.035194 131.94.186.14 -> 131.94.134.13 HTTP POST /wordpress/wp-admin/post.php HTTP/1.1  (application/x-www-form-urlencoded)
 25.035194 131.94.134.13 -> 131.94.186.14 TCP http > 65013 [ACK] Seq=1 Ack=1158 Win=8160 Len=0
 25.049192 131.94.132.160 -> 131.94.134.13 SSHv2 Encrypted request packet len=52
 25.050192 131.94.134.13 -> 131.94.132.160 SSHv2 Encrypted response packet len=52
 25.096185 131.94.132.160 -> 131.94.134.13 SSHv2 Encrypted request packet len=52
 25.097185 131.94.134.13 -> 131.94.132.160 SSHv2 Encrypted response packet len=52
 25.137179 131.94.132.160 -> 131.94.134.13 TCP 49477 > ssh [ACK] Seq=4601 Ack=9285 Win=65024 Len=0
 25.168174 131.94.132.160 -> 131.94.134.13 SSHv2 Encrypted request packet len=52
 25.169174 131.94.134.13 -> 131.94.132.160 SSHv2 Encrypted response packet len=52
 25.262160 131.94.132.160 -> 131.94.134.13 TCP 49477 > ssh [ACK] Seq=4653 Ack=9337 Win=65024 Len=0
 25.324150 131.94.132.160 -> 131.94.134.13 SSHv2 Encrypted request packet len=52
 25.325150 131.94.134.13 -> 131.94.132.160 SSHv2 Encrypted response packet len=52
 25.395139 131.94.132.160 -> 131.94.134.13 SSHv2 Encrypted request packet len=52
 25.398039 131.94.134.13 -> 131.94.132.160 SSHv2 Encrypted response packet len=52
 25.475127 131.94.132.160 -> 131.94.134.13 SSHv2 Encrypted request packet len=52
 25.480245 131.94.134.13 -> 131.94.132.160 SSHv2 Encrypted response packet len=52
 25.526120 131.94.132.160 -> 131.94.134.13 TCP 49477 > ssh [ACK] Seq=4809 Ack=9493 Win=64768 Len=0
 25.527119 131.94.132.160 -> 131.94.134.13 SSHv2 Encrypted request packet len=52
 25.529074 131.94.134.13 -> 131.94.132.160 SSHv2 Encrypted response packet len=52
 25.604108 131.94.132.160 -> 131.94.134.13 TCP 49477 > ssh [ACK] Seq=4861 Ack=9545 Win=64768 Len=0
 25.604108 131.94.132.160 -> 131.94.134.13 SSHv2 Encrypted request packet len=52
 25.605911 131.94.134.13 -> 131.94.132.160 SSHv2 Encrypted response packet len=52
 25.636395 131.94.134.13 -> 131.94.132.160 SSHv2 Encrypted response packet len=68
 25.637347 131.94.134.13 -> 131.94.132.160 SSHv2 Encrypted response packet len=68
 25.640102 131.94.132.160 -> 131.94.134.13 TCP 49477 > ssh [ACK] Seq=4913 Ack=9665 Win=64512 Len=0
 25.775082 131.94.132.160 -> 131.94.134.13 TCP 49477 > ssh [ACK] Seq=4913 Ack=9733 Win=64512 Len=0
 26.080035 Vmware_d6:f3:a1 -> Broadcast    ARP Who has 131.194.134.1?  Tell 131.194.134.16
 26.146025 131.94.132.160 -> 131.94.134.13 SSHv2 Encrypted request packet len=52
 26.148344 131.94.134.13 -> 131.94.132.160 SSHv2 Encrypted response packet len=52
 26.186019 131.94.132.160 -> 131.94.134.13 SSHv2 Encrypted request packet len=52
 26.187178 131.94.134.13 -> 131.94.132.160 SSHv2 Encrypted response packet len=52
 26.191018 131.94.132.160 -> 131.94.134.13 SSHv2 Encrypted request packet len=52
 26.191800 131.94.134.13 -> 131.94.132.160 SSHv2 Encrypted response packet len=52
 26.273006 131.94.132.160 -> 131.94.134.13 SSHv2 Encrypted request packet len=52
 26.274694 131.94.134.13 -> 131.94.132.160 SSHv2 Encrypted response packet len=52
 26.284004 131.94.132.160 -> 131.94.134.13 SSHv2 Encrypted request packet len=52
 26.306001 131.94.134.13 -> 131.94.132.160 SSHv2 Encrypted response packet len=52
 26.321999 131.94.132.160 -> 131.94.134.13 SSHv2 Encrypted request packet len=52
 26.323998 131.94.134.13 -> 131.94.132.160 SSHv2 Encrypted response packet len=52
 26.425983 131.94.132.160 -> 131.94.134.13 TCP 49477 > ssh [ACK] Seq=5225 Ack=10045 Win=64256 Len=0
 26.447979 131.94.132.160 -> 131.94.134.13 SSHv2 Encrypted request packet len=52
 26.450979 131.94.134.13 -> 131.94.132.160 SSHv2 Encrypted response packet len=52
 26.543965 131.94.132.160 -> 131.94.134.13 TCP 49477 > ssh [ACK] Seq=5277 Ack=10097 Win=64256 Len=0
 26.548964 131.94.132.160 -> 131.94.134.13 SSHv2 Encrypted request packet len=52
 26.551964 131.94.134.13 -> 131.94.132.160 SSHv2 Encrypted response packet len=52
 26.553963 131.94.134.13 -> 131.94.132.160 SSHv2 Encrypted response packet len=68
 26.553963 131.94.134.13 -> 131.94.132.160 SSHv2 Encrypted response packet len=68
 26.556963 131.94.132.160 -> 131.94.134.13 TCP 49477 > ssh [ACK] Seq=5329 Ack=10217 Win=65536 Len=0
 26.634951 131.94.132.160 -> 131.94.134.13 TCP 49477 > ssh [ACK] Seq=5329 Ack=10285 Win=65536 Len=0
 26.672945 131.94.132.160 -> 131.94.134.13 SSHv2 Encrypted request packet len=52
 26.673945 131.94.134.13 -> 131.94.132.160 SSHv2 Encrypted response packet len=52
 26.683943 131.94.132.160 -> 131.94.134.13 SSHv2 Encrypted request packet len=52
 26.684943 131.94.134.13 -> 131.94.132.160 SSHv2 Encrypted response packet len=52
 26.698941 131.94.132.160 -> 131.94.134.13 SSHv2 Encrypted request packet len=52
 26.699941 131.94.134.13 -> 131.94.132.160 SSHv2 Encrypted response packet len=52
 26.742935 131.94.132.160 -> 131.94.134.13 SSHv2 Encrypted request packet len=52
 26.744934 131.94.134.13 -> 131.94.132.160 SSHv2 Encrypted response packet len=52
 26.845919 131.94.132.160 -> 131.94.134.13 SSHv2 Encrypted request packet len=52
 26.846919 131.94.134.13 -> 131.94.132.160 SSHv2 Encrypted response packet len=52
 26.872915 131.94.132.160 -> 131.94.134.13 SSHv2 Encrypted request packet len=52
 26.873915 131.94.132.160 -> 131.94.134.13 SSHv2 Encrypted request packet len=52
 26.885913 131.94.134.13 -> 131.94.132.160 TCP ssh > 49477 [ACK] Seq=10545 Ack=5693 Win=11232 Len=0
 26.886913 131.94.134.13 -> 131.94.132.160 SSHv2 Encrypted response packet len=52
 26.886913 131.94.134.13 -> 131.94.132.160 SSHv2 Encrypted response packet len=52
 26.889912 131.94.132.160 -> 131.94.134.13 TCP 49477 > ssh [ACK] Seq=5693 Ack=10649 Win=65024 Len=0
 26.913909 131.94.132.160 -> 131.94.134.13 SSHv2 Encrypted request packet len=52
 26.914908 131.94.134.13 -> 131.94.132.160 SSHv2 Encrypted response packet len=52
 26.985898 131.94.134.13 -> 131.94.132.160 SSHv2 Encrypted response packet len=68
 26.987897 131.94.134.13 -> 131.94.132.160 SSHv2 Encrypted response packet len=1460
 26.988897 131.94.134.13 -> 131.94.132.160 SSHv2 Encrypted response packet len=112
 26.989897 131.94.132.160 -> 131.94.134.13 TCP 49477 > ssh [ACK] Seq=5745 Ack=10769 Win=65024 Len=0
 26.992897 131.94.132.160 -> 131.94.134.13 TCP 49477 > ssh [ACK] Seq=5745 Ack=12341 Win=65536 Len=0
 26.992897 131.94.134.13 -> 131.94.132.160 SSHv2 Encrypted response packet len=68
 26.993896 131.94.134.13 -> 131.94.132.160 SSHv2 Encrypted response packet len=68
 27.000895 131.94.132.160 -> 131.94.134.13 TCP 49477 > ssh [ACK] Seq=5745 Ack=12477 Win=65536 Len=0
 27.428830 Vmware_d6:f3:a1 -> Broadcast    ARP Who has 131.194.134.1?  Tell 131.194.134.16
 28.683639 Vmware_d6:f3:a1 -> Broadcast    ARP Who has 131.194.134.1?  Tell 131.194.134.16
 29.060582 131.94.134.13 -> 131.94.186.14 HTTP HTTP/1.1 200 OK  (text/html)
 29.060582 131.94.134.13 -> 131.94.186.14 HTTP Continuation or non-HTTP traffic
 29.060582 131.94.134.13 -> 131.94.186.14 TCP http > 65013 [FIN, ACK] Seq=1916 Ack=1158 Win=8160 Len=0
 29.078579 131.94.186.14 -> 131.94.134.13 TCP 65013 > http [ACK] Seq=1158 Ack=1916 Win=65536 Len=0
 29.078579 131.94.186.14 -> 131.94.134.13 TCP 65013 > http [ACK] Seq=1158 Ack=1917 Win=65536 Len=0
 29.082579 131.94.186.14 -> 131.94.134.13 TCP 65013 > http [FIN, ACK] Seq=1158 Ack=1917 Win=65536 Len=0
 29.082579 131.94.134.13 -> 131.94.186.14 TCP http > 65013 [ACK] Seq=1917 Ack=1159 Win=8160 Len=0
 29.216558 131.94.132.160 -> 131.94.134.13 SSHv2 Encrypted request packet len=52
 29.218558 131.94.134.13 -> 131.94.132.160 SSHv2 Encrypted response packet len=52
 29.221558 131.94.132.160 -> 131.94.134.13 SSHv2 Encrypted request packet len=52
 29.222558 131.94.134.13 -> 131.94.132.160 SSHv2 Encrypted response packet len=52
 29.290547 131.94.132.160 -> 131.94.134.13 SSHv2 Encrypted request packet len=52
 29.291547 131.94.134.13 -> 131.94.132.160 SSHv2 Encrypted response packet len=52
 29.342539 131.94.132.160 -> 131.94.134.13 SSHv2 Encrypted request packet len=52
 29.343539 131.94.134.13 -> 131.94.132.160 SSHv2 Encrypted response packet len=52
 29.401530 131.94.132.160 -> 131.94.134.13 SSHv2 Encrypted request packet len=52
 29.401530 131.94.134.13 -> 131.94.132.160 SSHv2 Encrypted response packet len=52
 29.429526 131.94.132.160 -> 131.94.134.13 SSHv2 Encrypted request packet len=52
 29.430526 131.94.134.13 -> 131.94.132.160 SSHv2 Encrypted response packet len=52
 29.483518 131.94.132.160 -> 131.94.134.13 SSHv2 Encrypted request packet len=52
 29.483518 131.94.134.13 -> 131.94.132.160 SSHv2 Encrypted response packet len=52
 29.489517 131.94.132.160 -> 131.94.134.13 SSHv2 Encrypted request packet len=52
 29.490517 131.94.134.13 -> 131.94.132.160 SSHv2 Encrypted response packet len=52
 29.498516 131.94.132.160 -> 131.94.134.13 SSHv2 Encrypted request packet len=52
 29.499515 131.94.134.13 -> 131.94.132.160 SSHv2 Encrypted response packet len=52
 29.520512 131.94.132.160 -> 131.94.134.13 SSHv2 Encrypted request packet len=52
 29.521512 131.94.134.13 -> 131.94.132.160 SSHv2 Encrypted response packet len=52
 29.535510 131.94.134.13 -> 131.94.132.160 SSHv2 Encrypted response packet len=68
 29.536510 131.94.134.13 -> 131.94.132.160 SSHv2 Encrypted response packet len=100
 29.539509 131.94.132.160 -> 131.94.134.13 TCP 49477 > ssh [ACK] Seq=6265 Ack=13065 Win=64768 Len=0
 29.539509 131.94.134.13 -> 131.94.132.160 SSHv2 Encrypted response packet len=1460
 29.539509 131.94.134.13 -> 131.94.132.160 SSHv2 Encrypted response packet len=424
 29.541509 131.94.134.13 -> 131.94.132.160 SSHv2 Encrypted response packet len=68
 29.543509 131.94.132.160 -> 131.94.134.13 TCP 49477 > ssh [ACK] Seq=6265 Ack=14625 Win=65536 Len=0
 29.543509 131.94.134.13 -> 131.94.132.160 SSHv2 Encrypted response packet len=68
 29.544509 131.94.132.160 -> 131.94.134.13 TCP 49477 > ssh [ACK] Seq=6265 Ack=15117 Win=65024 Len=0
 29.631495 131.94.132.160 -> 131.94.134.13 TCP 49477 > ssh [ACK] Seq=6265 Ack=15185 Win=65024 Len=0
 31.246250 131.94.186.14 -> 131.94.134.13 TCP 8542 > http [SYN] Seq=0 Win=8192 Len=0 MSS=1460 WS=8
 31.246250 131.94.134.13 -> 131.94.186.14 TCP http > 8542 [SYN, ACK] Seq=0 Ack=1 Win=5840 Len=0 MSS=1460 WS=5
 31.248250 131.94.186.14 -> 131.94.134.13 TCP 8542 > http [ACK] Seq=1 Ack=1 Win=65536 Len=0
 31.251249 131.94.186.14 -> 131.94.134.13 HTTP POST /wordpress/wp-admin/admin-ajax.php HTTP/1.1  (application/x-www-form-urlencoded)
 31.251249 131.94.134.13 -> 131.94.186.14 TCP http > 8542 [ACK] Seq=1 Ack=1036 Win=7936 Len=0
 31.697181 131.94.134.13 -> 131.94.186.14 HTTP HTTP/1.1 200 OK  (application/json)
 31.698181 131.94.134.13 -> 131.94.186.14 TCP http > 8542 [FIN, ACK] Seq=442 Ack=1036 Win=7936 Len=0
 31.718178 131.94.186.14 -> 131.94.134.13 TCP 8542 > http [ACK] Seq=1036 Ack=443 Win=65024 Len=0
 31.719178 131.94.186.14 -> 131.94.134.13 TCP 8542 > http [FIN, ACK] Seq=1036 Ack=443 Win=65024 Len=0
 31.719178 131.94.134.13 -> 131.94.186.14 TCP http > 8542 [ACK] Seq=443 Ack=1037 Win=7936 Len=0
 32.279093 Vmware_d6:f3:a1 -> Broadcast    ARP Who has 131.194.134.1?  Tell 131.194.134.16
 33.076972 131.94.186.14 -> 131.94.134.13 SSH Encrypted request packet len=52
